[0 ms] UsbSnoop compiled on Jan 18 2003 22:41:32 loading
[0 ms] UsbSnoop - DriverEntry(f78d7c40) : Windows NT WDM version 1.32
[0 ms] UsbSnoop - AddDevice(f78d7f50) : DriverObject 826a6340, pdo 826b8a00
[0 ms] UsbSnoop - DispatchAny(f78d5610) : IRP_MJ_PNP (0x00000018)
[0 ms] UsbSnoop - MyDispatchPNP(f78d7ee0) : IRP_MJ_PNP (0x00000018)
[0 ms] UsbSnoop - DispatchAny(f78d5610) : IRP_MJ_PNP (IRP_MN_QUERY_RESOURCE_REQUIREMENTS)
[0 ms] UsbSnoop - MyDispatchPNP(f78d7ee0) : IRP_MJ_PNP (IRP_MN_QUERY_RESOURCE_REQUIREMENTS)
[0 ms] UsbSnoop - DispatchAny(f78d5610) : IRP_MJ_PNP (IRP_MN_FILTER_RESOURCE_REQUIREMENTS)
[0 ms] UsbSnoop - MyDispatchPNP(f78d7ee0) : IRP_MJ_PNP (IRP_MN_FILTER_RESOURCE_REQUIREMENTS)
[1 ms] UsbSnoop - DispatchAny(f78d5610) : IRP_MJ_PNP (IRP_MN_START_DEVICE)
[1 ms] UsbSnoop - MyDispatchPNP(f78d7ee0) : IRP_MJ_PNP (IRP_MN_START_DEVICE)
[1 ms] UsbSnoop - DispatchAny(f78d5610) : IRP_MJ_INTERNAL_DEVICE_CONTROL
[1 ms] UsbSnoop - MyDispatchInternalIOCTL(f78d6e80) : fdo=826b8a00, Irp=825fc370, IRQL=0
[1 ms]  >>>  URB 1 going down  >>> 
-- URB_FUNCTION_GET_DESCRIPTOR_FROM_DEVICE:
  TransferBufferLength = 000003e8
  TransferBuffer       = 826168d8
  TransferBufferMDL    = 00000000
  Index                = 00000000
  DescriptorType       = 00000002 (USB_CONFIGURATION_DESCRIPTOR_TYPE)
  LanguageId           = 00000000
[1 ms] UsbSnoop - DispatchAny(f78d5610) : IRP_MJ_SYSTEM_CONTROL
[7 ms] UsbSnoop - MyInternalIOCTLCompletion(f78d6db0) : fido=00000000, Irp=825fc370, Context=826ac418, IRQL=2
[7 ms]  <<<  URB 1 coming back  <<< 
-- URB_FUNCTION_CONTROL_TRANSFER:
  PipeHandle           = 82a382a0
  TransferFlags        = 0000000b (USBD_TRANSFER_DIRECTION_IN, USBD_SHORT_TRANSFER_OK)
  TransferBufferLength = 00000020
  TransferBuffer       = 826168d8
  TransferBufferMDL    = 8264d138
    00000000: 09 02 20 00 01 01 00 80 fa 09 04 00 00 02 ff 00
    00000010: 00 00 07 05 82 02 40 00 0a 07 05 02 02 40 00 0a
  UrbLink              = 00000000
  SetupPacket          =
    00000000: 80 06 00 02 00 00 e8 03
[7 ms] UsbSnoop - DispatchAny(f78d5610) : IRP_MJ_INTERNAL_DEVICE_CONTROL
[7 ms] UsbSnoop - MyDispatchInternalIOCTL(f78d6e80) : fdo=826b8a00, Irp=825fc370, IRQL=0
[7 ms]  >>>  URB 2 going down  >>> 
-- URB_FUNCTION_SELECT_CONFIGURATION:
  ConfigurationDescriptor = 0x826168d8 (configure)
  ConfigurationDescriptor : bLength             = 9
  ConfigurationDescriptor : bDescriptorType     = 0x00000002
  ConfigurationDescriptor : wTotalLength        = 0x00000020
  ConfigurationDescriptor : bNumInterfaces      = 0x00000001
  ConfigurationDescriptor : bConfigurationValue = 0x00000001
  ConfigurationDescriptor : iConfiguration      = 0x00000000
  ConfigurationDescriptor : bmAttributes        = 0x00000080
  ConfigurationDescriptor : MaxPower            = 0x000000fa
  ConfigurationHandle     = 0x00000000
  Interface[0]: Length            = 56
  Interface[0]: InterfaceNumber   = 0
  Interface[0]: AlternateSetting  = 0
[58 ms] UsbSnoop - MyInternalIOCTLCompletion(f78d6db0) : fido=00000000, Irp=825fc370, Context=82a41d00, IRQL=0
[58 ms]  <<<  URB 2 coming back  <<< 
-- URB_FUNCTION_SELECT_CONFIGURATION:
  ConfigurationDescriptor = 0x826168d8 (configure)
  ConfigurationDescriptor : bLength             = 9
  ConfigurationDescriptor : bDescriptorType     = 0x00000002
  ConfigurationDescriptor : wTotalLength        = 0x00000020
  ConfigurationDescriptor : bNumInterfaces      = 0x00000001
  ConfigurationDescriptor : bConfigurationValue = 0x00000001
  ConfigurationDescriptor : iConfiguration      = 0x00000000
  ConfigurationDescriptor : bmAttributes        = 0x00000080
  ConfigurationDescriptor : MaxPower            = 0x000000fa
  ConfigurationHandle     = 0x827f1998
  Interface[0]: Length            = 56
  Interface[0]: InterfaceNumber   = 0
  Interface[0]: AlternateSetting  = 0
  Interface[0]: Class             = 0x000000ff
  Interface[0]: SubClass          = 0x00000000
  Interface[0]: Protocol          = 0x00000000
  Interface[0]: InterfaceHandle   = 0x82a3d278
  Interface[0]: NumberOfPipes     = 2
  Interface[0]: Pipes[0] : MaximumPacketSize = 0x00000040
  Interface[0]: Pipes[0] : EndpointAddress   = 0x00000082
  Interface[0]: Pipes[0] : Interval          = 0x0000000a
  Interface[0]: Pipes[0] : PipeType          = 0x00000002 (UsbdPipeTypeBulk)
  Interface[0]: Pipes[0] : PipeHandle        = 0x82a3d294
  Interface[0]: Pipes[0] : MaxTransferSize   = 0x00001000
  Interface[0]: Pipes[0] : PipeFlags         = 0x00000000
  Interface[0]: Pipes[1] : MaximumPacketSize = 0x00000040
  Interface[0]: Pipes[1] : EndpointAddress   = 0x00000002
  Interface[0]: Pipes[1] : Interval          = 0x0000000a
  Interface[0]: Pipes[1] : PipeType          = 0x00000002 (UsbdPipeTypeBulk)
  Interface[0]: Pipes[1] : PipeHandle        = 0x82a3d2b4
  Interface[0]: Pipes[1] : MaxTransferSize   = 0x00001000
  Interface[0]: Pipes[1] : PipeFlags         = 0x00000000
[58 ms] UsbSnoop - DispatchAny(f78d5610) : IRP_MJ_INTERNAL_DEVICE_CONTROL
[58 ms] UsbSnoop - MyDispatchInternalIOCTL(f78d6e80) : fdo=826b8a00, Irp=825fc370, IRQL=0
[58 ms]  >>>  URB 3 going down  >>> 
-- URB_FUNCTION_GET_DESCRIPTOR_FROM_DEVICE:
  TransferBufferLength = 00000012
  TransferBuffer       = f7980774
  TransferBufferMDL    = 00000000
  Index                = 00000000
  DescriptorType       = 00000001 (USB_DEVICE_DESCRIPTOR_TYPE)
  LanguageId           = 00000000
[62 ms] UsbSnoop - MyInternalIOCTLCompletion(f78d6db0) : fido=00000000, Irp=825fc370, Context=8260f4d8, IRQL=2
[62 ms]  <<<  URB 3 coming back  <<< 
-- URB_FUNCTION_CONTROL_TRANSFER:
  PipeHandle           = 82a382a0
  TransferFlags        = 0000000b (USBD_TRANSFER_DIRECTION_IN, USBD_SHORT_TRANSFER_OK)
  TransferBufferLength = 00000012
  TransferBuffer       = f7980774
  TransferBufferMDL    = 8264d138
    00000000: 12 01 10 01 ff 00 00 10 eb 03 03 21 00 02 01 02
    00000010: 03 01
  UrbLink              = 00000000
  SetupPacket          =
    00000000: 80 06 00 01 00 00 12 00
[62 ms] UsbSnoop - DispatchAny(f78d5610) : IRP_MJ_INTERNAL_DEVICE_CONTROL
[62 ms] UsbSnoop - MyDispatchInternalIOCTL(f78d6e80) : fdo=826b8a00, Irp=825fc370, IRQL=0
[62 ms]  >>>  URB 4 going down  >>> 
-- URB_FUNCTION_SELECT_INTERFACE:
  ConfigurationHandle     = 0x827f1998
  Interface: Length            = 56
  Interface: InterfaceNumber   = 0
  Interface: AlternateSetting  = 0
  Interface: Class             = 0x00000000
  Interface: SubClass          = 0x00000000
  Interface: Protocol          = 0x00000000
  Interface: InterfaceHandle   = 00000000
  Interface: NumberOfPipes     = 0
[121 ms] UsbSnoop - MyInternalIOCTLCompletion(f78d6db0) : fido=00000000, Irp=825fc370, Context=82887bd8, IRQL=0
[121 ms]  <<<  URB 4 coming back  <<< 
-- URB_FUNCTION_SELECT_INTERFACE:
  ConfigurationHandle     = 0x827f1998
  Interface: Length            = 56
  Interface: InterfaceNumber   = 0
  Interface: AlternateSetting  = 0
  Interface: Class             = 0x000000ff
  Interface: SubClass          = 0x00000000
  Interface: Protocol          = 0x00000000
  Interface: InterfaceHandle   = 82a62400
  Interface: NumberOfPipes     = 2
  Interface: Pipes[0] : MaximumPacketSize = 0x00000040
  Interface: Pipes[0] : EndpointAddress   = 0x00000082
  Interface: Pipes[0] : Interval          = 0x0000000a
  Interface: Pipes[0] : PipeType          = 0x00000002 (UsbdPipeTypeBulk)
  Interface: Pipes[0] : PipeHandle        = 0x82a6241c
  Interface: Pipes[0] : MaxTransferSize   = 0x00000000
  Interface: Pipes[0] : PipeFlags         = 0x00000000
  Interface: Pipes[1] : MaximumPacketSize = 0x00000040
  Interface: Pipes[1] : EndpointAddress   = 0x00000002
  Interface: Pipes[1] : Interval          = 0x0000000a
  Interface: Pipes[1] : PipeType          = 0x00000002 (UsbdPipeTypeBulk)
  Interface: Pipes[1] : PipeHandle        = 0x82a6243c
  Interface: Pipes[1] : MaxTransferSize   = 0x00000000
  Interface: Pipes[1] : PipeFlags         = 0x00000000
[121 ms] UsbSnoop - DispatchAny(f78d5610) : IRP_MJ_INTERNAL_DEVICE_CONTROL
[121 ms] UsbSnoop - MyDispatchInternalIOCTL(f78d6e80) : fdo=826b8a00, Irp=825fc370, IRQL=0
[121 ms]  >>>  URB 5 going down  >>> 
-- URB_FUNCTION_SELECT_INTERFACE:
  ConfigurationHandle     = 0x827f1998
  Interface: Length            = 56
  Interface: InterfaceNumber   = 0
  Interface: AlternateSetting  = 0
  Interface: Class             = 0x000000ff
  Interface: SubClass          = 0x00000000
  Interface: Protocol          = 0x00000000
  Interface: InterfaceHandle   = 82a62400
  Interface: NumberOfPipes     = 2
[184 ms] UsbSnoop - MyInternalIOCTLCompletion(f78d6db0) : fido=00000000, Irp=825fc370, Context=826ac418, IRQL=0
[184 ms]  <<<  URB 5 coming back  <<< 
-- URB_FUNCTION_SELECT_INTERFACE:
  ConfigurationHandle     = 0x827f1998
  Interface: Length            = 56
  Interface: InterfaceNumber   = 0
  Interface: AlternateSetting  = 0
  Interface: Class             = 0x000000ff
  Interface: SubClass          = 0x00000000
  Interface: Protocol          = 0x00000000
  Interface: InterfaceHandle   = 82a3d278
  Interface: NumberOfPipes     = 2
  Interface: Pipes[0] : MaximumPacketSize = 0x00000040
  Interface: Pipes[0] : EndpointAddress   = 0x00000082
  Interface: Pipes[0] : Interval          = 0x0000000a
  Interface: Pipes[0] : PipeType          = 0x00000002 (UsbdPipeTypeBulk)
  Interface: Pipes[0] : PipeHandle        = 0x82a3d294
  Interface: Pipes[0] : MaxTransferSize   = 0x00040000
  Interface: Pipes[0] : PipeFlags         = 0x00000000
  Interface: Pipes[1] : MaximumPacketSize = 0x00000040
  Interface: Pipes[1] : EndpointAddress   = 0x00000002
  Interface: Pipes[1] : Interval          = 0x0000000a
  Interface: Pipes[1] : PipeType          = 0x00000002 (UsbdPipeTypeBulk)
  Interface: Pipes[1] : PipeHandle        = 0x82a3d2b4
  Interface: Pipes[1] : MaxTransferSize   = 0x00040000
  Interface: Pipes[1] : PipeFlags         = 0x00000000
[184 ms] UsbSnoop - DispatchAny(f78d5610) : IRP_MJ_PNP (IRP_MN_QUERY_INTERFACE)
[184 ms] UsbSnoop - MyDispatchPNP(f78d7ee0) : IRP_MJ_PNP (IRP_MN_QUERY_INTERFACE)
[185 ms] UsbSnoop - DispatchAny(f78d5610) : IRP_MJ_PNP (IRP_MN_QUERY_CAPABILITIES)
[185 ms] UsbSnoop - MyDispatchPNP(f78d7ee0) : IRP_MJ_PNP (IRP_MN_QUERY_CAPABILITIES)
[185 ms] UsbSnoop - DispatchAny(f78d5610) : IRP_MJ_PNP (IRP_MN_QUERY_PNP_DEVICE_STATE)
[185 ms] UsbSnoop - MyDispatchPNP(f78d7ee0) : IRP_MJ_PNP (IRP_MN_QUERY_PNP_DEVICE_STATE)
[185 ms] UsbSnoop - DispatchAny(f78d5610) : IRP_MJ_PNP (IRP_MN_QUERY_DEVICE_RELATIONS)
[185 ms] UsbSnoop - MyDispatchPNP(f78d7ee0) : IRP_MJ_PNP (IRP_MN_QUERY_DEVICE_RELATIONS)
[48767 ms] UsbSnoop - DispatchAny(f78d5610) : IRP_MJ_INTERNAL_DEVICE_CONTROL
[48767 ms] UsbSnoop - MyDispatchInternalIOCTL(f78d6e80) : fdo=826b8a00, Irp=8264eb18, IRQL=0
[48767 ms]  >>>  URB 6 going down  >>> 
-- URB_FUNCTION_GET_DESCRIPTOR_FROM_DEVICE:
  TransferBufferLength = 00000080
  TransferBuffer       = f7bf65f0
  TransferBufferMDL    = 00000000
  Index                = 00000003
  DescriptorType       = 00000003 (USB_STRING_DESCRIPTOR_TYPE)
  LanguageId           = 00000409
[48772 ms] UsbSnoop - MyInternalIOCTLCompletion(f78d6db0) : fido=00000000, Irp=8264eb18, Context=829cb678, IRQL=2
[48772 ms]  <<<  URB 6 coming back  <<< 
-- URB_FUNCTION_CONTROL_TRANSFER:
  PipeHandle           = 82a382a0
  TransferFlags        = 0000000b (USBD_TRANSFER_DIRECTION_IN, USBD_SHORT_TRANSFER_OK)
  TransferBufferLength = 0000001c
  TransferBuffer       = f7bf65f0
  TransferBufferMDL    = 82836238
    00000000: 1c 03 30 00 30 00 41 00 30 00 30 00 30 00 30 00
    00000010: 30 00 30 00 44 00 33 00 46 00 00 00
  UrbLink              = 00000000
  SetupPacket          =
    00000000: 80 06 03 03 09 04 80 00
[49771 ms] UsbSnoop - DispatchAny(f78d5610) : IRP_MJ_INTERNAL_DEVICE_CONTROL
[49771 ms] UsbSnoop - MyDispatchInternalIOCTL(f78d6e80) : fdo=826b8a00, Irp=8264eb18, IRQL=0
[49771 ms]  >>>  URB 7 going down  >>> 
-- URB_FUNCTION_GET_DESCRIPTOR_FROM_DEVICE:
  TransferBufferLength = 00000080
  TransferBuffer       = f7c2ce78
  TransferBufferMDL    = 00000000
  Index                = 00000003
  DescriptorType       = 00000003 (USB_STRING_DESCRIPTOR_TYPE)
  LanguageId           = 00000409
[49776 ms] UsbSnoop - MyInternalIOCTLCompletion(f78d6db0) : fido=00000000, Irp=8264eb18, Context=8264ecb8, IRQL=2
[49776 ms]  <<<  URB 7 coming back  <<< 
-- URB_FUNCTION_CONTROL_TRANSFER:
  PipeHandle           = 82a382a0
  TransferFlags        = 0000000b (USBD_TRANSFER_DIRECTION_IN, USBD_SHORT_TRANSFER_OK)
  TransferBufferLength = 0000001c
  TransferBuffer       = f7c2ce78
  TransferBufferMDL    = 82836238
    00000000: 1c 03 30 00 30 00 41 00 30 00 30 00 30 00 30 00
    00000010: 30 00 30 00 44 00 33 00 46 00 00 00
  UrbLink              = 00000000
  SetupPacket          =
    00000000: 80 06 03 03 09 04 80 00
[49787 ms] UsbSnoop - DispatchAny(f78d5610) : IRP_MJ_INTERNAL_DEVICE_CONTROL
[49787 ms] UsbSnoop - MyDispatchInternalIOCTL(f78d6e80) : fdo=826b8a00, Irp=82b38860, IRQL=0
[49787 ms]  >>>  URB 8 going down  >>> 
-- URB_FUNCTION_BULK_OR_INTERRUPT_TRANSFER:
  PipeHandle           = 82a3d2b4 [endpoint 0x00000002]
  TransferFlags        = 00000000 (USBD_TRANSFER_DIRECTION_OUT, ~USBD_SHORT_TRANSFER_OK)
  TransferBufferLength = 0000000b
  TransferBuffer       = f7c3dc18
  TransferBufferMDL    = 00000000
    00000000: 1b 00 00 01 00 00 00 0e 01 f3 97
  UrbLink              = 00000000
[49787 ms] UsbSnoop - DispatchAny(f78d5610) : IRP_MJ_INTERNAL_DEVICE_CONTROL
[49787 ms] UsbSnoop - MyDispatchInternalIOCTL(f78d6e80) : fdo=826b8a00, Irp=826a9b18, IRQL=0
[49787 ms]  >>>  URB 9 going down  >>> 
-- URB_FUNCTION_BULK_OR_INTERRUPT_TRANSFER:
  PipeHandle           = 82a3d294 [endpoint 0x00000082]
  TransferFlags        = 00000003 (USBD_TRANSFER_DIRECTION_IN, USBD_SHORT_TRANSFER_OK)
  TransferBufferLength = 00000118
  TransferBuffer       = f7c3edf8
  TransferBufferMDL    = 00000000
  UrbLink              = 00000000
[49787 ms] UsbSnoop - MyInternalIOCTLCompletion(f78d6db0) : fido=00000000, Irp=826a9b18, Context=829d8560, IRQL=2
[49787 ms]  <<<  URB 9 coming back  <<< 
-- URB_FUNCTION_BULK_OR_INTERRUPT_TRANSFER:
  PipeHandle           = 82a3d294 [endpoint 0x00000082]
  TransferFlags        = 00000003 (USBD_TRANSFER_DIRECTION_IN, USBD_SHORT_TRANSFER_OK)
  TransferBufferLength = 00000026
  TransferBuffer       = f7c3edf8
  TransferBufferMDL    = 826240b8
    00000000: 1b 00 00 1c 00 00 00 0e 86 01 ff 21 04 00 ff 21
    00000010: 04 00 00 a0 00 00 0d 3f 4a 54 41 47 49 43 45 6d
    00000020: 6b 49 49 00 24 3f
  UrbLink              = 00000000
[49788 ms] UsbSnoop - MyInternalIOCTLCompletion(f78d6db0) : fido=00000000, Irp=82b38860, Context=82a2e960, IRQL=2
[49788 ms]  <<<  URB 8 coming back  <<< 
-- URB_FUNCTION_BULK_OR_INTERRUPT_TRANSFER:
  PipeHandle           = 82a3d2b4 [endpoint 0x00000002]
  TransferFlags        = 00000000 (USBD_TRANSFER_DIRECTION_OUT, ~USBD_SHORT_TRANSFER_OK)
  TransferBufferLength = 0000000b
  TransferBuffer       = f7c3dc18
  TransferBufferMDL    = 82a69e50
  UrbLink              = 00000000
[49817 ms] UsbSnoop - DispatchAny(f78d5610) : IRP_MJ_INTERNAL_DEVICE_CONTROL
[49817 ms] UsbSnoop - MyDispatchInternalIOCTL(f78d6e80) : fdo=826b8a00, Irp=826ebb18, IRQL=0
[49817 ms]  >>>  URB 10 going down  >>> 
-- URB_FUNCTION_BULK_OR_INTERRUPT_TRANSFER:
  PipeHandle           = 82a3d294 [endpoint 0x00000082]
  TransferFlags        = 00000003 (USBD_TRANSFER_DIRECTION_IN, USBD_SHORT_TRANSFER_OK)
  TransferBufferLength = 00000118
  TransferBuffer       = f7c3cdf8
  TransferBufferMDL    = 00000000
  UrbLink              = 00000000
[56327 ms] UsbSnoop - DispatchAny(f78d5610) : IRP_MJ_INTERNAL_DEVICE_CONTROL
[56327 ms] UsbSnoop - MyDispatchInternalIOCTL(f78d6e80) : fdo=826b8a00, Irp=82b3bcd8, IRQL=0
[56327 ms]  >>>  URB 11 going down  >>> 
-- URB_FUNCTION_BULK_OR_INTERRUPT_TRANSFER:
  PipeHandle           = 82a3d2b4 [endpoint 0x00000002]
  TransferFlags        = 00000000 (USBD_TRANSFER_DIRECTION_OUT, ~USBD_SHORT_TRANSFER_OK)
  TransferBufferLength = 0000000c
  TransferBuffer       = f7bffc18
  TransferBufferMDL    = 00000000
    00000000: 1b 01 00 02 00 00 00 0e 03 06 96 76
  UrbLink              = 00000000
[56328 ms] UsbSnoop - MyInternalIOCTLCompletion(f78d6db0) : fido=00000000, Irp=826ebb18, Context=826c0910, IRQL=2
[56328 ms]  <<<  URB 10 coming back  <<< 
-- URB_FUNCTION_BULK_OR_INTERRUPT_TRANSFER:
  PipeHandle           = 82a3d294 [endpoint 0x00000082]
  TransferFlags        = 00000003 (USBD_TRANSFER_DIRECTION_IN, USBD_SHORT_TRANSFER_OK)
  TransferBufferLength = 0000000d
  TransferBuffer       = f7c3cdf8
  TransferBufferMDL    = 82a30870
    00000000: 1b 01 00 03 00 00 00 0e 81 0a 14 27 36
  UrbLink              = 00000000
[56328 ms] UsbSnoop - MyInternalIOCTLCompletion(f78d6db0) : fido=00000000, Irp=82b3bcd8, Context=8264d2f0, IRQL=2
[56328 ms]  <<<  URB 11 coming back  <<< 
-- URB_FUNCTION_BULK_OR_INTERRUPT_TRANSFER:
  PipeHandle           = 82a3d2b4 [endpoint 0x00000002]
  TransferFlags        = 00000000 (USBD_TRANSFER_DIRECTION_OUT, ~USBD_SHORT_TRANSFER_OK)
  TransferBufferLength = 0000000c
  TransferBuffer       = f7bffc18
  TransferBufferMDL    = 82b37c48
  UrbLink              = 00000000
[56328 ms] UsbSnoop - DispatchAny(f78d5610) : IRP_MJ_INTERNAL_DEVICE_CONTROL
[56328 ms] UsbSnoop - MyDispatchInternalIOCTL(f78d6e80) : fdo=826b8a00, Irp=826a5cb0, IRQL=0
[56328 ms]  >>>  URB 12 going down  >>> 
-- URB_FUNCTION_BULK_OR_INTERRUPT_TRANSFER:
  PipeHandle           = 82a3d294 [endpoint 0x00000082]
  TransferFlags        = 00000003 (USBD_TRANSFER_DIRECTION_IN, USBD_SHORT_TRANSFER_OK)
  TransferBufferLength = 00000118
  TransferBuffer       = f7c3bdf8
  TransferBufferMDL    = 00000000
  UrbLink              = 00000000
[59813 ms] UsbSnoop - DispatchAny(f78d5610) : IRP_MJ_INTERNAL_DEVICE_CONTROL
[59813 ms] UsbSnoop - MyDispatchInternalIOCTL(f78d6e80) : fdo=826b8a00, Irp=8268a7c0, IRQL=0
[59813 ms]  >>>  URB 13 going down  >>> 
-- URB_FUNCTION_BULK_OR_INTERRUPT_TRANSFER:
  PipeHandle           = 82a3d2b4 [endpoint 0x00000002]
  TransferFlags        = 00000000 (USBD_TRANSFER_DIRECTION_OUT, ~USBD_SHORT_TRANSFER_OK)
  TransferBufferLength = 0000000d
  TransferBuffer       = f7bd8d80
  TransferBufferMDL    = 00000000
    00000000: 1b 02 00 03 00 00 00 0e 02 03 01 f2 31
  UrbLink              = 00000000
[59814 ms] UsbSnoop - MyInternalIOCTLCompletion(f78d6db0) : fido=00000000, Irp=826a5cb0, Context=826217c0, IRQL=2
[59814 ms]  <<<  URB 12 coming back  <<< 
-- URB_FUNCTION_BULK_OR_INTERRUPT_TRANSFER:
  PipeHandle           = 82a3d294 [endpoint 0x00000082]
  TransferFlags        = 00000003 (USBD_TRANSFER_DIRECTION_IN, USBD_SHORT_TRANSFER_OK)
  TransferBufferLength = 0000000b
  TransferBuffer       = f7c3bdf8
  TransferBufferMDL    = 82b37c48
    00000000: 1b 02 00 01 00 00 00 0e 80 1d 09
  UrbLink              = 00000000
[59814 ms] UsbSnoop - MyInternalIOCTLCompletion(f78d6db0) : fido=00000000, Irp=8268a7c0, Context=8269ee80, IRQL=2
[59814 ms]  <<<  URB 13 coming back  <<< 
-- URB_FUNCTION_BULK_OR_INTERRUPT_TRANSFER:
  PipeHandle           = 82a3d2b4 [endpoint 0x00000002]
  TransferFlags        = 00000000 (USBD_TRANSFER_DIRECTION_OUT, ~USBD_SHORT_TRANSFER_OK)
  TransferBufferLength = 0000000d
  TransferBuffer       = f7bd8d80
  TransferBufferMDL    = 82a30870
  UrbLink              = 00000000
[59815 ms] UsbSnoop - DispatchAny(f78d5610) : IRP_MJ_INTERNAL_DEVICE_CONTROL
[59815 ms] UsbSnoop - MyDispatchInternalIOCTL(f78d6e80) : fdo=826b8a00, Irp=8268a7c0, IRQL=0
[59815 ms]  >>>  URB 14 going down  >>> 
-- URB_FUNCTION_BULK_OR_INTERRUPT_TRANSFER:
  PipeHandle           = 82a3d294 [endpoint 0x00000082]
  TransferFlags        = 00000003 (USBD_TRANSFER_DIRECTION_IN, USBD_SHORT_TRANSFER_OK)
  TransferBufferLength = 00000118
  TransferBuffer       = f7babdf8
  TransferBufferMDL    = 00000000
  UrbLink              = 00000000
[59815 ms] UsbSnoop - DispatchAny(f78d5610) : IRP_MJ_INTERNAL_DEVICE_CONTROL
[59815 ms] UsbSnoop - MyDispatchInternalIOCTL(f78d6e80) : fdo=826b8a00, Irp=826a5cb0, IRQL=0
[59815 ms]  >>>  URB 15 going down  >>> 
-- URB_FUNCTION_BULK_OR_INTERRUPT_TRANSFER:
  PipeHandle           = 82a3d2b4 [endpoint 0x00000002]
  TransferFlags        = 00000000 (USBD_TRANSFER_DIRECTION_OUT, ~USBD_SHORT_TRANSFER_OK)
  TransferBufferLength = 0000000c
  TransferBuffer       = f7bd9d80
  TransferBufferMDL    = 00000000
    00000000: 1b 03 00 02 00 00 00 0e 03 06 6c ed
  UrbLink              = 00000000
[59815 ms] UsbSnoop - MyInternalIOCTLCompletion(f78d6db0) : fido=00000000, Irp=826a5cb0, Context=8264ecb8, IRQL=2
[59815 ms]  <<<  URB 15 coming back  <<< 
-- URB_FUNCTION_BULK_OR_INTERRUPT_TRANSFER:
  PipeHandle           = 82a3d2b4 [endpoint 0x00000002]
  TransferFlags        = 00000000 (USBD_TRANSFER_DIRECTION_OUT, ~USBD_SHORT_TRANSFER_OK)
  TransferBufferLength = 0000000c
  TransferBuffer       = f7bd9d80
  TransferBufferMDL    = 82b37c48
  UrbLink              = 00000000
[59816 ms] UsbSnoop - MyInternalIOCTLCompletion(f78d6db0) : fido=00000000, Irp=8268a7c0, Context=82b37cf8, IRQL=2
[59816 ms]  <<<  URB 14 coming back  <<< 
-- URB_FUNCTION_BULK_OR_INTERRUPT_TRANSFER:
  PipeHandle           = 82a3d294 [endpoint 0x00000082]
  TransferFlags        = 00000003 (USBD_TRANSFER_DIRECTION_IN, USBD_SHORT_TRANSFER_OK)
  TransferBufferLength = 0000000d
  TransferBuffer       = f7babdf8
  TransferBufferMDL    = 82a30870
    00000000: 1b 03 00 03 00 00 00 0e 81 0a 14 69 6e
  UrbLink              = 00000000
[59817 ms] UsbSnoop - DispatchAny(f78d5610) : IRP_MJ_INTERNAL_DEVICE_CONTROL
[59817 ms] UsbSnoop - MyDispatchInternalIOCTL(f78d6e80) : fdo=826b8a00, Irp=8268a7c0, IRQL=0
[59817 ms]  >>>  URB 16 going down  >>> 
-- URB_FUNCTION_BULK_OR_INTERRUPT_TRANSFER:
  PipeHandle           = 82a3d2b4 [endpoint 0x00000002]
  TransferFlags        = 00000000 (USBD_TRANSFER_DIRECTION_OUT, ~USBD_SHORT_TRANSFER_OK)
  TransferBufferLength = 00000010
  TransferBuffer       = f7b86d80
  TransferBufferMDL    = 00000000
    00000000: 1b 04 00 06 00 00 00 0e 02 1b 00 00 00 00 07 72
  UrbLink              = 00000000
[59817 ms] UsbSnoop - DispatchAny(f78d5610) : IRP_MJ_INTERNAL_DEVICE_CONTROL
[59817 ms] UsbSnoop - MyDispatchInternalIOCTL(f78d6e80) : fdo=826b8a00, Irp=826a5cb0, IRQL=0
[59817 ms]  >>>  URB 17 going down  >>> 
-- URB_FUNCTION_BULK_OR_INTERRUPT_TRANSFER:
  PipeHandle           = 82a3d294 [endpoint 0x00000082]
  TransferFlags        = 00000003 (USBD_TRANSFER_DIRECTION_IN, USBD_SHORT_TRANSFER_OK)
  TransferBufferLength = 00000118
  TransferBuffer       = f7bbadf8
  TransferBufferMDL    = 00000000
  UrbLink              = 00000000
[59817 ms] UsbSnoop - MyInternalIOCTLCompletion(f78d6db0) : fido=00000000, Irp=826a5cb0, Context=82afb930, IRQL=2
[59817 ms]  <<<  URB 17 coming back  <<< 
-- URB_FUNCTION_BULK_OR_INTERRUPT_TRANSFER:
  PipeHandle           = 82a3d294 [endpoint 0x00000082]
  TransferFlags        = 00000003 (USBD_TRANSFER_DIRECTION_IN, USBD_SHORT_TRANSFER_OK)
  TransferBufferLength = 0000000b
  TransferBuffer       = f7bbadf8
  TransferBufferMDL    = 82b37c48
    00000000: 1b 04 00 01 00 00 00 0e 80 ac 14
  UrbLink              = 00000000
[59817 ms] UsbSnoop - MyInternalIOCTLCompletion(f78d6db0) : fido=00000000, Irp=8268a7c0, Context=82616860, IRQL=2
[59817 ms]  <<<  URB 16 coming back  <<< 
-- URB_FUNCTION_BULK_OR_INTERRUPT_TRANSFER:
  PipeHandle           = 82a3d2b4 [endpoint 0x00000002]
  TransferFlags        = 00000000 (USBD_TRANSFER_DIRECTION_OUT, ~USBD_SHORT_TRANSFER_OK)
  TransferBufferLength = 00000010
  TransferBuffer       = f7b86d80
  TransferBufferMDL    = 82a30870
  UrbLink              = 00000000
[59817 ms] UsbSnoop - DispatchAny(f78d5610) : IRP_MJ_INTERNAL_DEVICE_CONTROL
[59817 ms] UsbSnoop - MyDispatchInternalIOCTL(f78d6e80) : fdo=826b8a00, Irp=8268a7c0, IRQL=0
[59817 ms]  >>>  URB 18 going down  >>> 
-- URB_FUNCTION_BULK_OR_INTERRUPT_TRANSFER:
  PipeHandle           = 82a3d294 [endpoint 0x00000082]
  TransferFlags        = 00000003 (USBD_TRANSFER_DIRECTION_IN, USBD_SHORT_TRANSFER_OK)
  TransferBufferLength = 00000118
  TransferBuffer       = f7bb6df8
  TransferBufferMDL    = 00000000
  UrbLink              = 00000000
[59818 ms] UsbSnoop - DispatchAny(f78d5610) : IRP_MJ_INTERNAL_DEVICE_CONTROL
[59818 ms] UsbSnoop - MyDispatchInternalIOCTL(f78d6e80) : fdo=826b8a00, Irp=826a5cb0, IRQL=0
[59818 ms]  >>>  URB 19 going down  >>> 
-- URB_FUNCTION_BULK_OR_INTERRUPT_TRANSFER:
  PipeHandle           = 82a3d2b4 [endpoint 0x00000002]
  TransferFlags        = 00000000 (USBD_TRANSFER_DIRECTION_OUT, ~USBD_SHORT_TRANSFER_OK)
  TransferBufferLength = 0000000c
  TransferBuffer       = f7bb9d80
  TransferBufferMDL    = 00000000
    00000000: 1b 05 00 02 00 00 00 0e 03 0e 3b c5
  UrbLink              = 00000000
[59818 ms] UsbSnoop - MyInternalIOCTLCompletion(f78d6db0) : fido=00000000, Irp=826a5cb0, Context=82a2e960, IRQL=2
[59818 ms]  <<<  URB 19 coming back  <<< 
-- URB_FUNCTION_BULK_OR_INTERRUPT_TRANSFER:
  PipeHandle           = 82a3d2b4 [endpoint 0x00000002]
  TransferFlags        = 00000000 (USBD_TRANSFER_DIRECTION_OUT, ~USBD_SHORT_TRANSFER_OK)
  TransferBufferLength = 0000000c
  TransferBuffer       = f7bb9d80
  TransferBufferMDL    = 82b37c48
  UrbLink              = 00000000
[59819 ms] UsbSnoop - MyInternalIOCTLCompletion(f78d6db0) : fido=00000000, Irp=8268a7c0, Context=8264ecb8, IRQL=2
[59819 ms]  <<<  URB 18 coming back  <<< 
-- URB_FUNCTION_BULK_OR_INTERRUPT_TRANSFER:
  PipeHandle           = 82a3d294 [endpoint 0x00000082]
  TransferFlags        = 00000003 (USBD_TRANSFER_DIRECTION_IN, USBD_SHORT_TRANSFER_OK)
  TransferBufferLength = 0000000f
  TransferBuffer       = f7bb6df8
  TransferBufferMDL    = 82a30870
    00000000: 1b 05 00 05 00 00 00 0e 81 3f 20 50 19 f7 4e
  UrbLink              = 00000000
[59819 ms] UsbSnoop - DispatchAny(f78d5610) : IRP_MJ_INTERNAL_DEVICE_CONTROL
[59819 ms] UsbSnoop - MyDispatchInternalIOCTL(f78d6e80) : fdo=826b8a00, Irp=8268a7c0, IRQL=0
[59819 ms]  >>>  URB 20 going down  >>> 
-- URB_FUNCTION_BULK_OR_INTERRUPT_TRANSFER:
  PipeHandle           = 82a3d294 [endpoint 0x00000082]
  TransferFlags        = 00000003 (USBD_TRANSFER_DIRECTION_IN, USBD_SHORT_TRANSFER_OK)
  TransferBufferLength = 00000118
  TransferBuffer       = f7be5df8
  TransferBufferMDL    = 00000000
  UrbLink              = 00000000
[59820 ms] UsbSnoop - DispatchAny(f78d5610) : IRP_MJ_INTERNAL_DEVICE_CONTROL
[59820 ms] UsbSnoop - MyDispatchInternalIOCTL(f78d6e80) : fdo=826b8a00, Irp=826a5cb0, IRQL=0
[59820 ms]  >>>  URB 21 going down  >>> 
-- URB_FUNCTION_BULK_OR_INTERRUPT_TRANSFER:
  PipeHandle           = 82a3d2b4 [endpoint 0x00000002]
  TransferFlags        = 00000000 (USBD_TRANSFER_DIRECTION_OUT, ~USBD_SHORT_TRANSFER_OK)
  TransferBufferLength = 0000000b
  TransferBuffer       = f7bf6d80
  TransferBufferMDL    = 00000000
    00000000: 1b 06 00 01 00 00 00 0e 14 6e cd
  UrbLink              = 00000000
[59820 ms] UsbSnoop - MyInternalIOCTLCompletion(f78d6db0) : fido=00000000, Irp=826a5cb0, Context=82afbd58, IRQL=2
[59820 ms]  <<<  URB 21 coming back  <<< 
-- URB_FUNCTION_BULK_OR_INTERRUPT_TRANSFER:
  PipeHandle           = 82a3d2b4 [endpoint 0x00000002]
  TransferFlags        = 00000000 (USBD_TRANSFER_DIRECTION_OUT, ~USBD_SHORT_TRANSFER_OK)
  TransferBufferLength = 0000000b
  TransferBuffer       = f7bf6d80
  TransferBufferMDL    = 82b37c48
  UrbLink              = 00000000
[59886 ms] UsbSnoop - MyInternalIOCTLCompletion(f78d6db0) : fido=00000000, Irp=8268a7c0, Context=82ac3148, IRQL=2
[59886 ms]  <<<  URB 20 coming back  <<< 
-- URB_FUNCTION_BULK_OR_INTERRUPT_TRANSFER:
  PipeHandle           = 82a3d294 [endpoint 0x00000082]
  TransferFlags        = 00000003 (USBD_TRANSFER_DIRECTION_IN, USBD_SHORT_TRANSFER_OK)
  TransferBufferLength = 0000000b
  TransferBuffer       = f7be5df8
  TransferBufferMDL    = 82a30870
    00000000: 1b 06 00 01 00 00 00 0e 80 c3 1f
  UrbLink              = 00000000
[59887 ms] UsbSnoop - DispatchAny(f78d5610) : IRP_MJ_INTERNAL_DEVICE_CONTROL
[59887 ms] UsbSnoop - MyDispatchInternalIOCTL(f78d6e80) : fdo=826b8a00, Irp=8268a7c0, IRQL=0
[59887 ms]  >>>  URB 22 going down  >>> 
-- URB_FUNCTION_BULK_OR_INTERRUPT_TRANSFER:
  PipeHandle           = 82a3d2b4 [endpoint 0x00000002]
  TransferFlags        = 00000000 (USBD_TRANSFER_DIRECTION_OUT, ~USBD_SHORT_TRANSFER_OK)
  TransferBufferLength = 00000014
  TransferBuffer       = f7bea0f0
  TransferBufferMDL    = 00000000
    00000000: 1b 07 00 0a 00 00 00 0e 05 b3 01 00 00 00 00 00
    00000010: 00 00 f5 22
  UrbLink              = 00000000
[59887 ms] UsbSnoop - DispatchAny(f78d5610) : IRP_MJ_INTERNAL_DEVICE_CONTROL
[59887 ms] UsbSnoop - MyDispatchInternalIOCTL(f78d6e80) : fdo=826b8a00, Irp=826a5cb0, IRQL=0
[59887 ms]  >>>  URB 23 going down  >>> 
-- URB_FUNCTION_BULK_OR_INTERRUPT_TRANSFER:
  PipeHandle           = 82a3d294 [endpoint 0x00000082]
  TransferFlags        = 00000003 (USBD_TRANSFER_DIRECTION_IN, USBD_SHORT_TRANSFER_OK)
  TransferBufferLength = 00000118
  TransferBuffer       = f7ba7df8
  TransferBufferMDL    = 00000000
  UrbLink              = 00000000
[59887 ms] UsbSnoop - MyInternalIOCTLCompletion(f78d6db0) : fido=00000000, Irp=8268a7c0, Context=826a8558, IRQL=2
[59887 ms]  <<<  URB 22 coming back  <<< 
-- URB_FUNCTION_BULK_OR_INTERRUPT_TRANSFER:
  PipeHandle           = 82a3d2b4 [endpoint 0x00000002]
  TransferFlags        = 00000000 (USBD_TRANSFER_DIRECTION_OUT, ~USBD_SHORT_TRANSFER_OK)
  TransferBufferLength = 00000014
  TransferBuffer       = f7bea0f0
  TransferBufferMDL    = 82a30870
  UrbLink              = 00000000
[59888 ms] UsbSnoop - MyInternalIOCTLCompletion(f78d6db0) : fido=00000000, Irp=826a5cb0, Context=8269ee80, IRQL=2
[59888 ms]  <<<  URB 23 coming back  <<< 
-- URB_FUNCTION_BULK_OR_INTERRUPT_TRANSFER:
  PipeHandle           = 82a3d294 [endpoint 0x00000082]
  TransferFlags        = 00000003 (USBD_TRANSFER_DIRECTION_IN, USBD_SHORT_TRANSFER_OK)
  TransferBufferLength = 0000000c
  TransferBuffer       = f7ba7df8
  TransferBufferMDL    = 82b37c48
    00000000: 1b 07 00 02 00 00 00 0e 82 ff d3 2d
  UrbLink              = 00000000
[59889 ms] UsbSnoop - DispatchAny(f78d5610) : IRP_MJ_INTERNAL_DEVICE_CONTROL
[59889 ms] UsbSnoop - MyDispatchInternalIOCTL(f78d6e80) : fdo=826b8a00, Irp=826a5cb0, IRQL=0
[59889 ms]  >>>  URB 24 going down  >>> 
-- URB_FUNCTION_BULK_OR_INTERRUPT_TRANSFER:
  PipeHandle           = 82a3d2b4 [endpoint 0x00000002]
  TransferFlags        = 00000000 (USBD_TRANSFER_DIRECTION_OUT, ~USBD_SHORT_TRANSFER_OK)
  TransferBufferLength = 00000014
  TransferBuffer       = f7be80f0
  TransferBufferMDL    = 00000000
    00000000: 1b 08 00 0a 00 00 00 0e 05 b2 01 00 00 00 01 00
    00000010: 00 00 e6 83
  UrbLink              = 00000000
[59890 ms] UsbSnoop - DispatchAny(f78d5610) : IRP_MJ_INTERNAL_DEVICE_CONTROL
[59890 ms] UsbSnoop - MyDispatchInternalIOCTL(f78d6e80) : fdo=826b8a00, Irp=8268a7c0, IRQL=0
[59890 ms]  >>>  URB 25 going down  >>> 
-- URB_FUNCTION_BULK_OR_INTERRUPT_TRANSFER:
  PipeHandle           = 82a3d294 [endpoint 0x00000082]
  TransferFlags        = 00000003 (USBD_TRANSFER_DIRECTION_IN, USBD_SHORT_TRANSFER_OK)
  TransferBufferLength = 00000118
  TransferBuffer       = f7bf5df8
  TransferBufferMDL    = 00000000
  UrbLink              = 00000000
[59890 ms] UsbSnoop - MyInternalIOCTLCompletion(f78d6db0) : fido=00000000, Irp=826a5cb0, Context=82a2e960, IRQL=2
[59890 ms]  <<<  URB 24 coming back  <<< 
-- URB_FUNCTION_BULK_OR_INTERRUPT_TRANSFER:
  PipeHandle           = 82a3d2b4 [endpoint 0x00000002]
  TransferFlags        = 00000000 (USBD_TRANSFER_DIRECTION_OUT, ~USBD_SHORT_TRANSFER_OK)
  TransferBufferLength = 00000014
  TransferBuffer       = f7be80f0
  TransferBufferMDL    = 82b37c48
  UrbLink              = 00000000
[59891 ms] UsbSnoop - MyInternalIOCTLCompletion(f78d6db0) : fido=00000000, Irp=8268a7c0, Context=82ac3148, IRQL=2
[59891 ms]  <<<  URB 25 coming back  <<< 
-- URB_FUNCTION_BULK_OR_INTERRUPT_TRANSFER:
  PipeHandle           = 82a3d294 [endpoint 0x00000082]
  TransferFlags        = 00000003 (USBD_TRANSFER_DIRECTION_IN, USBD_SHORT_TRANSFER_OK)
  TransferBufferLength = 0000000c
  TransferBuffer       = f7bf5df8
  TransferBufferMDL    = 82a30870
    00000000: 1b 08 00 02 00 00 00 0e 82 18 4a 28
  UrbLink              = 00000000
[59892 ms] UsbSnoop - DispatchAny(f78d5610) : IRP_MJ_INTERNAL_DEVICE_CONTROL
[59892 ms] UsbSnoop - MyDispatchInternalIOCTL(f78d6e80) : fdo=826b8a00, Irp=8268a7c0, IRQL=0
[59892 ms]  >>>  URB 26 going down  >>> 
-- URB_FUNCTION_BULK_OR_INTERRUPT_TRANSFER:
  PipeHandle           = 82a3d2b4 [endpoint 0x00000002]
  TransferFlags        = 00000000 (USBD_TRANSFER_DIRECTION_OUT, ~USBD_SHORT_TRANSFER_OK)
  TransferBufferLength = 0000000b
  TransferBuffer       = f7bf9d80
  TransferBufferMDL    = 00000000
    00000000: 1b 09 00 01 00 00 00 0e 15 55 6d
  UrbLink              = 00000000
[59892 ms] UsbSnoop - DispatchAny(f78d5610) : IRP_MJ_INTERNAL_DEVICE_CONTROL
[59892 ms] UsbSnoop - MyDispatchInternalIOCTL(f78d6e80) : fdo=826b8a00, Irp=826a5cb0, IRQL=0
[59892 ms]  >>>  URB 27 going down  >>> 
-- URB_FUNCTION_BULK_OR_INTERRUPT_TRANSFER:
  PipeHandle           = 82a3d294 [endpoint 0x00000082]
  TransferFlags        = 00000003 (USBD_TRANSFER_DIRECTION_IN, USBD_SHORT_TRANSFER_OK)
  TransferBufferLength = 00000118
  TransferBuffer       = f7bfadf8
  TransferBufferMDL    = 00000000
  UrbLink              = 00000000
[59892 ms] UsbSnoop - MyInternalIOCTLCompletion(f78d6db0) : fido=00000000, Irp=8268a7c0, Context=8269df00, IRQL=2
[59892 ms]  <<<  URB 26 coming back  <<< 
-- URB_FUNCTION_BULK_OR_INTERRUPT_TRANSFER:
  PipeHandle           = 82a3d2b4 [endpoint 0x00000002]
  TransferFlags        = 00000000 (USBD_TRANSFER_DIRECTION_OUT, ~USBD_SHORT_TRANSFER_OK)
  TransferBufferLength = 0000000b
  TransferBuffer       = f7bf9d80
  TransferBufferMDL    = 82a30870
  UrbLink              = 00000000
[59893 ms] UsbSnoop - MyInternalIOCTLCompletion(f78d6db0) : fido=00000000, Irp=826a5cb0, Context=82afb930, IRQL=2
[59893 ms]  <<<  URB 27 coming back  <<< 
-- URB_FUNCTION_BULK_OR_INTERRUPT_TRANSFER:
  PipeHandle           = 82a3d294 [endpoint 0x00000082]
  TransferFlags        = 00000003 (USBD_TRANSFER_DIRECTION_IN, USBD_SHORT_TRANSFER_OK)
  TransferBufferLength = 0000000b
  TransferBuffer       = f7bfadf8
  TransferBufferMDL    = 82b37c48
    00000000: 1b 09 00 01 00 00 00 0e 80 71 ae
  UrbLink              = 00000000
[59894 ms] UsbSnoop - DispatchAny(f78d5610) : IRP_MJ_INTERNAL_DEVICE_CONTROL
[59894 ms] UsbSnoop - MyDispatchInternalIOCTL(f78d6e80) : fdo=826b8a00, Irp=826a5cb0, IRQL=0
[59894 ms]  >>>  URB 28 going down  >>> 
-- URB_FUNCTION_BULK_OR_INTERRUPT_TRANSFER:
  PipeHandle           = 82a3d2b4 [endpoint 0x00000002]
  TransferFlags        = 00000000 (USBD_TRANSFER_DIRECTION_OUT, ~USBD_SHORT_TRANSFER_OK)
  TransferBufferLength = 0000000d
  TransferBuffer       = f7bf0d80
  TransferBufferMDL    = 00000000
    00000000: 1b 0a 00 03 00 00 00 0e 02 09 00 22 b4
  UrbLink              = 00000000
[59894 ms] UsbSnoop - DispatchAny(f78d5610) : IRP_MJ_INTERNAL_DEVICE_CONTROL
[59894 ms] UsbSnoop - MyDispatchInternalIOCTL(f78d6e80) : fdo=826b8a00, Irp=8268a7c0, IRQL=0
[59894 ms]  >>>  URB 29 going down  >>> 
-- URB_FUNCTION_BULK_OR_INTERRUPT_TRANSFER:
  PipeHandle           = 82a3d294 [endpoint 0x00000082]
  TransferFlags        = 00000003 (USBD_TRANSFER_DIRECTION_IN, USBD_SHORT_TRANSFER_OK)
  TransferBufferLength = 00000118
  TransferBuffer       = f7c0edf8
  TransferBufferMDL    = 00000000
  UrbLink              = 00000000
[59894 ms] UsbSnoop - MyInternalIOCTLCompletion(f78d6db0) : fido=00000000, Irp=826a5cb0, Context=826a8558, IRQL=2
[59894 ms]  <<<  URB 28 coming back  <<< 
-- URB_FUNCTION_BULK_OR_INTERRUPT_TRANSFER:
  PipeHandle           = 82a3d2b4 [endpoint 0x00000002]
  TransferFlags        = 00000000 (USBD_TRANSFER_DIRECTION_OUT, ~USBD_SHORT_TRANSFER_OK)
  TransferBufferLength = 0000000d
  TransferBuffer       = f7bf0d80
  TransferBufferMDL    = 82b37c48
  UrbLink              = 00000000
[59895 ms] UsbSnoop - MyInternalIOCTLCompletion(f78d6db0) : fido=00000000, Irp=8268a7c0, Context=82afbd58, IRQL=2
[59895 ms]  <<<  URB 29 coming back  <<< 
-- URB_FUNCTION_BULK_OR_INTERRUPT_TRANSFER:
  PipeHandle           = 82a3d294 [endpoint 0x00000082]
  TransferFlags        = 00000003 (USBD_TRANSFER_DIRECTION_IN, USBD_SHORT_TRANSFER_OK)
  TransferBufferLength = 0000000b
  TransferBuffer       = f7c0edf8
  TransferBufferMDL    = 82a30870
    00000000: 1b 0a 00 01 00 00 00 0e 80 a1 24
  UrbLink              = 00000000
[59896 ms] UsbSnoop - DispatchAny(f78d5610) : IRP_MJ_INTERNAL_DEVICE_CONTROL
[59896 ms] UsbSnoop - MyDispatchInternalIOCTL(f78d6e80) : fdo=826b8a00, Irp=8268a7c0, IRQL=0
[59896 ms]  >>>  URB 30 going down  >>> 
-- URB_FUNCTION_BULK_OR_INTERRUPT_TRANSFER:
  PipeHandle           = 82a3d2b4 [endpoint 0x00000002]
  TransferFlags        = 00000000 (USBD_TRANSFER_DIRECTION_OUT, ~USBD_SHORT_TRANSFER_OK)
  TransferBufferLength = 0000000d
  TransferBuffer       = f7c06d80
  TransferBufferMDL    = 00000000
    00000000: 1b 0b 00 03 00 00 00 0e 02 07 05 b8 55
  UrbLink              = 00000000
[59896 ms] UsbSnoop - DispatchAny(f78d5610) : IRP_MJ_INTERNAL_DEVICE_CONTROL
[59896 ms] UsbSnoop - MyDispatchInternalIOCTL(f78d6e80) : fdo=826b8a00, Irp=826a5cb0, IRQL=0
[59896 ms]  >>>  URB 31 going down  >>> 
-- URB_FUNCTION_BULK_OR_INTERRUPT_TRANSFER:
  PipeHandle           = 82a3d294 [endpoint 0x00000082]
  TransferFlags        = 00000003 (USBD_TRANSFER_DIRECTION_IN, USBD_SHORT_TRANSFER_OK)
  TransferBufferLength = 00000118
  TransferBuffer       = f7bcbdf8
  TransferBufferMDL    = 00000000
  UrbLink              = 00000000
[59896 ms] UsbSnoop - MyInternalIOCTLCompletion(f78d6db0) : fido=00000000, Irp=826a5cb0, Context=829d8560, IRQL=2
[59896 ms]  <<<  URB 31 coming back  <<< 
-- URB_FUNCTION_BULK_OR_INTERRUPT_TRANSFER:
  PipeHandle           = 82a3d294 [endpoint 0x00000082]
  TransferFlags        = 00000003 (USBD_TRANSFER_DIRECTION_IN, USBD_SHORT_TRANSFER_OK)
  TransferBufferLength = 0000000b
  TransferBuffer       = f7bcbdf8
  TransferBufferMDL    = 82b37c48
    00000000: 1b 0b 00 01 00 00 00 0e 80 1e a5
  UrbLink              = 00000000
[59896 ms] UsbSnoop - MyInternalIOCTLCompletion(f78d6db0) : fido=00000000, Irp=8268a7c0, Context=82a2e960, IRQL=2
[59896 ms]  <<<  URB 30 coming back  <<< 
-- URB_FUNCTION_BULK_OR_INTERRUPT_TRANSFER:
  PipeHandle           = 82a3d2b4 [endpoint 0x00000002]
  TransferFlags        = 00000000 (USBD_TRANSFER_DIRECTION_OUT, ~USBD_SHORT_TRANSFER_OK)
  TransferBufferLength = 0000000d
  TransferBuffer       = f7c06d80
  TransferBufferMDL    = 82a30870
  UrbLink              = 00000000
[59899 ms] UsbSnoop - DispatchAny(f78d5610) : IRP_MJ_INTERNAL_DEVICE_CONTROL
[59899 ms] UsbSnoop - MyDispatchInternalIOCTL(f78d6e80) : fdo=826b8a00, Irp=826ebb18, IRQL=0
[59899 ms]  >>>  URB 32 going down  >>> 
-- URB_FUNCTION_BULK_OR_INTERRUPT_TRANSFER:
  PipeHandle           = 82a3d2b4 [endpoint 0x00000002]
  TransferFlags        = 00000000 (USBD_TRANSFER_DIRECTION_OUT, ~USBD_SHORT_TRANSFER_OK)
  TransferBufferLength = 00000135
  TransferBuffer       = f7c0dae0
  TransferBufferMDL    = 00000000
    00000000: 1b 0c 00 2b 01 00 00 0e 0c ff 6f ff ff fe ff fd
    00000010: ff 00 00 00 00 01 00 00 00 8f 26 b6 fd fe ff bd
    00000020: fa 00 00 00 00 01 00 00 00 00 00 00 00 00 00 00
    00000030: 00 00 00 00 00 00 00 00 00 00 00 00 00 00 00 00
    00000040: 00 00 00 00 00 00 00 00 00 00 00 00 00 00 00 00
    00000050: 00 00 00 00 00 00 00 00 00 00 00 00 00 00 00 00
    00000060: 00 00 00 00 00 00 00 00 00 00 00 00 00 00 00 00
    00000070: 00 00 00 00 00 00 00 00 00 00 00 00 00 00 00 00
    00000080: 00 00 00 00 00 00 00 00 00 00 00 00 00 00 00 00
    00000090: 00 00 00 00 00 00 00 00 00 00 00 00 00 00 00 00
    000000a0: 00 00 00 00 00 00 00 00 00 00 00 00 00 00 00 00
    000000b0: 00 00 00 00 00 00 00 00 00 00 00 00 00 00 00 00
    000000c0: 00 00 00 00 00 00 00 00 00 00 00 00 00 00 00 00
    000000d0: 00 00 00 00 00 00 00 00 00 00 00 00 00 00 00 00
    000000e0: 00 00 00 00 00 00 00 00 00 00 00 00 00 00 00 00
    000000f0: 00 00 00 00 00 00 00 00 00 31 57 00 80 00 04 00
    00000100: 3f 00 00 00 00 00 80 00 00 00 00 00 00 00 00 00
    00000110: 00 00 00 00 00 00 00 00 00 00 00 00 00 00 00 00
    00000120: 3e 3d 00 01 00 00 01 00 00 01 00 60 00 00 00 00
    00000130: 00 1c 00 2a 01
  UrbLink              = 00000000
[59900 ms] UsbSnoop - DispatchAny(f78d5610) : IRP_MJ_INTERNAL_DEVICE_CONTROL
[59900 ms] UsbSnoop - MyDispatchInternalIOCTL(f78d6e80) : fdo=826b8a00, Irp=826a5cb0, IRQL=0
[59900 ms]  >>>  URB 33 going down  >>> 
-- URB_FUNCTION_BULK_OR_INTERRUPT_TRANSFER:
  PipeHandle           = 82a3d294 [endpoint 0x00000082]
  TransferFlags        = 00000003 (USBD_TRANSFER_DIRECTION_IN, USBD_SHORT_TRANSFER_OK)
  TransferBufferLength = 00000118
  TransferBuffer       = f7c02df8
  TransferBufferMDL    = 00000000
  UrbLink              = 00000000
[59902 ms] UsbSnoop - MyInternalIOCTLCompletion(f78d6db0) : fido=00000000, Irp=826ebb18, Context=826a8558, IRQL=2
[59902 ms]  <<<  URB 32 coming back  <<< 
-- URB_FUNCTION_BULK_OR_INTERRUPT_TRANSFER:
  PipeHandle           = 82a3d2b4 [endpoint 0x00000002]
  TransferFlags        = 00000000 (USBD_TRANSFER_DIRECTION_OUT, ~USBD_SHORT_TRANSFER_OK)
  TransferBufferLength = 00000135
  TransferBuffer       = f7c0dae0
  TransferBufferMDL    = 82a30870
  UrbLink              = 00000000
[59992 ms] UsbSnoop - MyInternalIOCTLCompletion(f78d6db0) : fido=00000000, Irp=826a5cb0, Context=826c0910, IRQL=2
[59992 ms]  <<<  URB 33 coming back  <<< 
-- URB_FUNCTION_BULK_OR_INTERRUPT_TRANSFER:
  PipeHandle           = 82a3d294 [endpoint 0x00000082]
  TransferFlags        = 00000003 (USBD_TRANSFER_DIRECTION_IN, USBD_SHORT_TRANSFER_OK)
  TransferBufferLength = 0000000b
  TransferBuffer       = f7c02df8
  TransferBufferMDL    = 82b37c48
    00000000: 1b 0c 00 01 00 00 00 0e 80 10 39
  UrbLink              = 00000000
[59993 ms] UsbSnoop - DispatchAny(f78d5610) : IRP_MJ_INTERNAL_DEVICE_CONTROL
[59993 ms] UsbSnoop - MyDispatchInternalIOCTL(f78d6e80) : fdo=826b8a00, Irp=826a5cb0, IRQL=0
[59993 ms]  >>>  URB 34 going down  >>> 
-- URB_FUNCTION_BULK_OR_INTERRUPT_TRANSFER:
  PipeHandle           = 82a3d2b4 [endpoint 0x00000002]
  TransferFlags        = 00000000 (USBD_TRANSFER_DIRECTION_OUT, ~USBD_SHORT_TRANSFER_OK)
  TransferBufferLength = 0000000c
  TransferBuffer       = f7c09d80
  TransferBufferMDL    = 00000000
    00000000: 1b 0d 00 02 00 00 00 0e 0a 01 1e 95
  UrbLink              = 00000000
[59993 ms] UsbSnoop - DispatchAny(f78d5610) : IRP_MJ_INTERNAL_DEVICE_CONTROL
[59993 ms] UsbSnoop - MyDispatchInternalIOCTL(f78d6e80) : fdo=826b8a00, Irp=826ebb18, IRQL=0
[59993 ms]  >>>  URB 35 going down  >>> 
-- URB_FUNCTION_BULK_OR_INTERRUPT_TRANSFER:
  PipeHandle           = 82a3d294 [endpoint 0x00000082]
  TransferFlags        = 00000003 (USBD_TRANSFER_DIRECTION_IN, USBD_SHORT_TRANSFER_OK)
  TransferBufferLength = 00000118
  TransferBuffer       = f7c12df8
  TransferBufferMDL    = 00000000
  UrbLink              = 00000000
[59993 ms] UsbSnoop - MyInternalIOCTLCompletion(f78d6db0) : fido=00000000, Irp=826a5cb0, Context=8269ee80, IRQL=2
[59993 ms]  <<<  URB 34 coming back  <<< 
-- URB_FUNCTION_BULK_OR_INTERRUPT_TRANSFER:
  PipeHandle           = 82a3d2b4 [endpoint 0x00000002]
  TransferFlags        = 00000000 (USBD_TRANSFER_DIRECTION_OUT, ~USBD_SHORT_TRANSFER_OK)
  TransferBufferLength = 0000000c
  TransferBuffer       = f7c09d80
  TransferBufferMDL    = 82b37c48
  UrbLink              = 00000000
[59996 ms] UsbSnoop - MyInternalIOCTLCompletion(f78d6db0) : fido=00000000, Irp=826ebb18, Context=8264d2f0, IRQL=2
[59996 ms]  <<<  URB 35 coming back  <<< 
-- URB_FUNCTION_BULK_OR_INTERRUPT_TRANSFER:
  PipeHandle           = 82a3d294 [endpoint 0x00000082]
  TransferFlags        = 00000003 (USBD_TRANSFER_DIRECTION_IN, USBD_SHORT_TRANSFER_OK)
  TransferBufferLength = 0000000b
  TransferBuffer       = f7c12df8
  TransferBufferMDL    = 82a30870
    00000000: 1b 0d 00 01 00 00 00 0e 80 af b8
  UrbLink              = 00000000
[59998 ms] UsbSnoop - DispatchAny(f78d5610) : IRP_MJ_INTERNAL_DEVICE_CONTROL
[59998 ms] UsbSnoop - MyDispatchInternalIOCTL(f78d6e80) : fdo=826b8a00, Irp=826ebb18, IRQL=0
[59998 ms]  >>>  URB 36 going down  >>> 
-- URB_FUNCTION_BULK_OR_INTERRUPT_TRANSFER:
  PipeHandle           = 82a3d2b4 [endpoint 0x00000002]
  TransferFlags        = 00000000 (USBD_TRANSFER_DIRECTION_OUT, ~USBD_SHORT_TRANSFER_OK)
  TransferBufferLength = 0000000b
  TransferBuffer       = f7c25d80
  TransferBufferMDL    = 00000000
    00000000: 1b 0e 00 01 00 00 00 0e 14 d2 e0
  UrbLink              = 00000000
[59998 ms] UsbSnoop - DispatchAny(f78d5610) : IRP_MJ_INTERNAL_DEVICE_CONTROL
[59998 ms] UsbSnoop - MyDispatchInternalIOCTL(f78d6e80) : fdo=826b8a00, Irp=826a5cb0, IRQL=0
[59998 ms]  >>>  URB 37 going down  >>> 
-- URB_FUNCTION_BULK_OR_INTERRUPT_TRANSFER:
  PipeHandle           = 82a3d294 [endpoint 0x00000082]
  TransferFlags        = 00000003 (USBD_TRANSFER_DIRECTION_IN, USBD_SHORT_TRANSFER_OK)
  TransferBufferLength = 00000118
  TransferBuffer       = f7c18df8
  TransferBufferMDL    = 00000000
  UrbLink              = 00000000
[59998 ms] UsbSnoop - MyInternalIOCTLCompletion(f78d6db0) : fido=00000000, Irp=826a5cb0, Context=82afb930, IRQL=2
[59998 ms]  <<<  URB 37 coming back  <<< 
-- URB_FUNCTION_BULK_OR_INTERRUPT_TRANSFER:
  PipeHandle           = 82a3d294 [endpoint 0x00000082]
  TransferFlags        = 00000003 (USBD_TRANSFER_DIRECTION_IN, USBD_SHORT_TRANSFER_OK)
  TransferBufferLength = 00000010
  TransferBuffer       = f7c18df8
  TransferBufferMDL    = 82b37c48
    00000000: 1b ff ff 06 00 00 00 0e e0 73 00 00 00 00 71 25
  UrbLink              = 00000000
[59998 ms] UsbSnoop - MyInternalIOCTLCompletion(f78d6db0) : fido=00000000, Irp=826ebb18, Context=82b37cf8, IRQL=2
[59998 ms]  <<<  URB 36 coming back  <<< 
-- URB_FUNCTION_BULK_OR_INTERRUPT_TRANSFER:
  PipeHandle           = 82a3d2b4 [endpoint 0x00000002]
  TransferFlags        = 00000000 (USBD_TRANSFER_DIRECTION_OUT, ~USBD_SHORT_TRANSFER_OK)
  TransferBufferLength = 0000000b
  TransferBuffer       = f7c25d80
  TransferBufferMDL    = 82a30870
  UrbLink              = 00000000
[59999 ms] UsbSnoop - DispatchAny(f78d5610) : IRP_MJ_INTERNAL_DEVICE_CONTROL
[59999 ms] UsbSnoop - MyDispatchInternalIOCTL(f78d6e80) : fdo=826b8a00, Irp=82b38860, IRQL=0
[59999 ms]  >>>  URB 38 going down  >>> 
-- URB_FUNCTION_BULK_OR_INTERRUPT_TRANSFER:
  PipeHandle           = 82a3d294 [endpoint 0x00000082]
  TransferFlags        = 00000003 (USBD_TRANSFER_DIRECTION_IN, USBD_SHORT_TRANSFER_OK)
  TransferBufferLength = 00000118
  TransferBuffer       = f7c14df8
  TransferBufferMDL    = 00000000
  UrbLink              = 00000000
[60065 ms] UsbSnoop - MyInternalIOCTLCompletion(f78d6db0) : fido=00000000, Irp=82b38860, Context=8269ee80, IRQL=2
[60065 ms]  <<<  URB 38 coming back  <<< 
-- URB_FUNCTION_BULK_OR_INTERRUPT_TRANSFER:
  PipeHandle           = 82a3d294 [endpoint 0x00000082]
  TransferFlags        = 00000003 (USBD_TRANSFER_DIRECTION_IN, USBD_SHORT_TRANSFER_OK)
  TransferBufferLength = 0000000b
  TransferBuffer       = f7c14df8
  TransferBufferMDL    = 82a30870
    00000000: 1b 0e 00 01 00 00 00 0e 80 7f 32
  UrbLink              = 00000000
[60067 ms] UsbSnoop - DispatchAny(f78d5610) : IRP_MJ_INTERNAL_DEVICE_CONTROL
[60067 ms] UsbSnoop - MyDispatchInternalIOCTL(f78d6e80) : fdo=826b8a00, Irp=82b38860, IRQL=0
[60067 ms]  >>>  URB 39 going down  >>> 
-- URB_FUNCTION_BULK_OR_INTERRUPT_TRANSFER:
  PipeHandle           = 82a3d2b4 [endpoint 0x00000002]
  TransferFlags        = 00000000 (USBD_TRANSFER_DIRECTION_OUT, ~USBD_SHORT_TRANSFER_OK)
  TransferBufferLength = 00000014
  TransferBuffer       = f7c1fa80
  TransferBufferMDL    = 00000000
    00000000: 1b 0f 00 0a 00 00 00 0e 05 b2 01 00 00 00 01 00
    00000010: 00 00 cb f3
  UrbLink              = 00000000
[60067 ms] UsbSnoop - DispatchAny(f78d5610) : IRP_MJ_INTERNAL_DEVICE_CONTROL
[60067 ms] UsbSnoop - MyDispatchInternalIOCTL(f78d6e80) : fdo=826b8a00, Irp=826a5cb0, IRQL=0
[60067 ms]  >>>  URB 40 going down  >>> 
-- URB_FUNCTION_BULK_OR_INTERRUPT_TRANSFER:
  PipeHandle           = 82a3d294 [endpoint 0x00000082]
  TransferFlags        = 00000003 (USBD_TRANSFER_DIRECTION_IN, USBD_SHORT_TRANSFER_OK)
  TransferBufferLength = 00000118
  TransferBuffer       = f7c19df8
  TransferBufferMDL    = 00000000
  UrbLink              = 00000000
[60067 ms] UsbSnoop - MyInternalIOCTLCompletion(f78d6db0) : fido=00000000, Irp=82b38860, Context=8269df00, IRQL=2
[60067 ms]  <<<  URB 39 coming back  <<< 
-- URB_FUNCTION_BULK_OR_INTERRUPT_TRANSFER:
  PipeHandle           = 82a3d2b4 [endpoint 0x00000002]
  TransferFlags        = 00000000 (USBD_TRANSFER_DIRECTION_OUT, ~USBD_SHORT_TRANSFER_OK)
  TransferBufferLength = 00000014
  TransferBuffer       = f7c1fa80
  TransferBufferMDL    = 82a30870
  UrbLink              = 00000000
[60068 ms] UsbSnoop - MyInternalIOCTLCompletion(f78d6db0) : fido=00000000, Irp=826a5cb0, Context=829d8560, IRQL=2
[60068 ms]  <<<  URB 40 coming back  <<< 
-- URB_FUNCTION_BULK_OR_INTERRUPT_TRANSFER:
  PipeHandle           = 82a3d294 [endpoint 0x00000082]
  TransferFlags        = 00000003 (USBD_TRANSFER_DIRECTION_IN, USBD_SHORT_TRANSFER_OK)
  TransferBufferLength = 0000000c
  TransferBuffer       = f7c19df8
  TransferBufferMDL    = 82b37c48
    00000000: 1b 0f 00 02 00 00 00 0e 82 18 a8 c1
  UrbLink              = 00000000
[60069 ms] UsbSnoop - DispatchAny(f78d5610) : IRP_MJ_INTERNAL_DEVICE_CONTROL
[60069 ms] UsbSnoop - MyDispatchInternalIOCTL(f78d6e80) : fdo=826b8a00, Irp=826a5cb0, IRQL=0
[60069 ms]  >>>  URB 41 going down  >>> 
-- URB_FUNCTION_BULK_OR_INTERRUPT_TRANSFER:
  PipeHandle           = 82a3d2b4 [endpoint 0x00000002]
  TransferFlags        = 00000000 (USBD_TRANSFER_DIRECTION_OUT, ~USBD_SHORT_TRANSFER_OK)
  TransferBufferLength = 0000000b
  TransferBuffer       = f7b97dc0
  TransferBufferMDL    = 00000000
    00000000: 1b 10 00 01 00 00 00 0e 15 2e 9a
  UrbLink              = 00000000
[60069 ms] UsbSnoop - DispatchAny(f78d5610) : IRP_MJ_INTERNAL_DEVICE_CONTROL
[60069 ms] UsbSnoop - MyDispatchInternalIOCTL(f78d6e80) : fdo=826b8a00, Irp=82b38860, IRQL=0
[60069 ms]  >>>  URB 42 going down  >>> 
-- URB_FUNCTION_BULK_OR_INTERRUPT_TRANSFER:
  PipeHandle           = 82a3d294 [endpoint 0x00000082]
  TransferFlags        = 00000003 (USBD_TRANSFER_DIRECTION_IN, USBD_SHORT_TRANSFER_OK)
  TransferBufferLength = 00000118
  TransferBuffer       = f7c1ddf8
  TransferBufferMDL    = 00000000
  UrbLink              = 00000000
[60069 ms] UsbSnoop - MyInternalIOCTLCompletion(f78d6db0) : fido=00000000, Irp=826a5cb0, Context=82a2e960, IRQL=2
[60069 ms]  <<<  URB 41 coming back  <<< 
-- URB_FUNCTION_BULK_OR_INTERRUPT_TRANSFER:
  PipeHandle           = 82a3d2b4 [endpoint 0x00000002]
  TransferFlags        = 00000000 (USBD_TRANSFER_DIRECTION_OUT, ~USBD_SHORT_TRANSFER_OK)
  TransferBufferLength = 0000000b
  TransferBuffer       = f7b97dc0
  TransferBufferMDL    = 82b37c48
  UrbLink              = 00000000
[60070 ms] UsbSnoop - MyInternalIOCTLCompletion(f78d6db0) : fido=00000000, Irp=82b38860, Context=82afbd58, IRQL=2
[60070 ms]  <<<  URB 42 coming back  <<< 
-- URB_FUNCTION_BULK_OR_INTERRUPT_TRANSFER:
  PipeHandle           = 82a3d294 [endpoint 0x00000082]
  TransferFlags        = 00000003 (USBD_TRANSFER_DIRECTION_IN, USBD_SHORT_TRANSFER_OK)
  TransferBufferLength = 0000000b
  TransferBuffer       = f7c1ddf8
  TransferBufferMDL    = 82a30870
    00000000: 1b 10 00 01 00 00 00 0e 80 0a 59
  UrbLink              = 00000000
[60071 ms] UsbSnoop - DispatchAny(f78d5610) : IRP_MJ_INTERNAL_DEVICE_CONTROL
[60071 ms] UsbSnoop - MyDispatchInternalIOCTL(f78d6e80) : fdo=826b8a00, Irp=82b38860, IRQL=0
[60071 ms]  >>>  URB 43 going down  >>> 
-- URB_FUNCTION_BULK_OR_INTERRUPT_TRANSFER:
  PipeHandle           = 82a3d2b4 [endpoint 0x00000002]
  TransferFlags        = 00000000 (USBD_TRANSFER_DIRECTION_OUT, ~USBD_SHORT_TRANSFER_OK)
  TransferBufferLength = 00000010
  TransferBuffer       = f7c26dc0
  TransferBufferMDL    = 00000000
    00000000: 1b 11 00 06 00 00 00 0e 02 1c 00 38 00 00 7e 4b
  UrbLink              = 00000000
[60071 ms] UsbSnoop - DispatchAny(f78d5610) : IRP_MJ_INTERNAL_DEVICE_CONTROL
[60071 ms] UsbSnoop - MyDispatchInternalIOCTL(f78d6e80) : fdo=826b8a00, Irp=826a5cb0, IRQL=0
[60071 ms]  >>>  URB 44 going down  >>> 
-- URB_FUNCTION_BULK_OR_INTERRUPT_TRANSFER:
  PipeHandle           = 82a3d294 [endpoint 0x00000082]
  TransferFlags        = 00000003 (USBD_TRANSFER_DIRECTION_IN, USBD_SHORT_TRANSFER_OK)
  TransferBufferLength = 00000118
  TransferBuffer       = f7c2cdf8
  TransferBufferMDL    = 00000000
  UrbLink              = 00000000
[60071 ms] UsbSnoop - MyInternalIOCTLCompletion(f78d6db0) : fido=00000000, Irp=82b38860, Context=82616860, IRQL=2
[60071 ms]  <<<  URB 43 coming back  <<< 
-- URB_FUNCTION_BULK_OR_INTERRUPT_TRANSFER:
  PipeHandle           = 82a3d2b4 [endpoint 0x00000002]
  TransferFlags        = 00000000 (USBD_TRANSFER_DIRECTION_OUT, ~USBD_SHORT_TRANSFER_OK)
  TransferBufferLength = 00000010
  TransferBuffer       = f7c26dc0
  TransferBufferMDL    = 82a30870
  UrbLink              = 00000000
[60072 ms] UsbSnoop - MyInternalIOCTLCompletion(f78d6db0) : fido=00000000, Irp=826a5cb0, Context=82afb930, IRQL=2
[60072 ms]  <<<  URB 44 coming back  <<< 
-- URB_FUNCTION_BULK_OR_INTERRUPT_TRANSFER:
  PipeHandle           = 82a3d294 [endpoint 0x00000082]
  TransferFlags        = 00000003 (USBD_TRANSFER_DIRECTION_IN, USBD_SHORT_TRANSFER_OK)
  TransferBufferLength = 0000000b
  TransferBuffer       = f7c2cdf8
  TransferBufferMDL    = 82b37c48
    00000000: 1b 11 00 01 00 00 00 0e 80 b5 d8
  UrbLink              = 00000000
[60073 ms] UsbSnoop - DispatchAny(f78d5610) : IRP_MJ_INTERNAL_DEVICE_CONTROL
[60073 ms] UsbSnoop - MyDispatchInternalIOCTL(f78d6e80) : fdo=826b8a00, Irp=826a5cb0, IRQL=0
[60073 ms]  >>>  URB 45 going down  >>> 
-- URB_FUNCTION_BULK_OR_INTERRUPT_TRANSFER:
  PipeHandle           = 82a3d294 [endpoint 0x00000082]
  TransferFlags        = 00000003 (USBD_TRANSFER_DIRECTION_IN, USBD_SHORT_TRANSFER_OK)
  TransferBufferLength = 00000118
  TransferBuffer       = f7ba0df8
  TransferBufferMDL    = 00000000
  UrbLink              = 00000000
[60426 ms] UsbSnoop - DispatchAny(f78d5610) : IRP_MJ_INTERNAL_DEVICE_CONTROL
[60426 ms] UsbSnoop - MyDispatchInternalIOCTL(f78d6e80) : fdo=826b8a00, Irp=8268a7c0, IRQL=0
[60426 ms]  >>>  URB 46 going down  >>> 
-- URB_FUNCTION_BULK_OR_INTERRUPT_TRANSFER:
  PipeHandle           = 82a3d2b4 [endpoint 0x00000002]
  TransferFlags        = 00000000 (USBD_TRANSFER_DIRECTION_OUT, ~USBD_SHORT_TRANSFER_OK)
  TransferBufferLength = 0000000b
  TransferBuffer       = f7c3ddc0
  TransferBufferMDL    = 00000000
    00000000: 1b 12 00 01 00 00 00 0e 14 c8 80
  UrbLink              = 00000000
[60427 ms] UsbSnoop - MyInternalIOCTLCompletion(f78d6db0) : fido=00000000, Irp=8268a7c0, Context=82afbd58, IRQL=2
[60427 ms]  <<<  URB 46 coming back  <<< 
-- URB_FUNCTION_BULK_OR_INTERRUPT_TRANSFER:
  PipeHandle           = 82a3d2b4 [endpoint 0x00000002]
  TransferFlags        = 00000000 (USBD_TRANSFER_DIRECTION_OUT, ~USBD_SHORT_TRANSFER_OK)
  TransferBufferLength = 0000000b
  TransferBuffer       = f7c3ddc0
  TransferBufferMDL    = 82a30870
  UrbLink              = 00000000
[60493 ms] UsbSnoop - MyInternalIOCTLCompletion(f78d6db0) : fido=00000000, Irp=826a5cb0, Context=8269df00, IRQL=2
[60493 ms]  <<<  URB 45 coming back  <<< 
-- URB_FUNCTION_BULK_OR_INTERRUPT_TRANSFER:
  PipeHandle           = 82a3d294 [endpoint 0x00000082]
  TransferFlags        = 00000003 (USBD_TRANSFER_DIRECTION_IN, USBD_SHORT_TRANSFER_OK)
  TransferBufferLength = 0000000b
  TransferBuffer       = f7ba0df8
  TransferBufferMDL    = 82b37c48
    00000000: 1b 12 00 01 00 00 00 0e 80 65 52
  UrbLink              = 00000000
[60494 ms] UsbSnoop - DispatchAny(f78d5610) : IRP_MJ_INTERNAL_DEVICE_CONTROL
[60494 ms] UsbSnoop - MyDispatchInternalIOCTL(f78d6e80) : fdo=826b8a00, Irp=826a5cb0, IRQL=0
[60494 ms]  >>>  URB 47 going down  >>> 
-- URB_FUNCTION_BULK_OR_INTERRUPT_TRANSFER:
  PipeHandle           = 82a3d2b4 [endpoint 0x00000002]
  TransferFlags        = 00000000 (USBD_TRANSFER_DIRECTION_OUT, ~USBD_SHORT_TRANSFER_OK)
  TransferBufferLength = 00000014
  TransferBuffer       = f7c2fca8
  TransferBufferMDL    = 00000000
    00000000: 1b 13 00 0a 00 00 00 0e 05 b2 01 00 00 00 01 00
    00000010: 00 00 6e 3b
  UrbLink              = 00000000
[60494 ms] UsbSnoop - DispatchAny(f78d5610) : IRP_MJ_INTERNAL_DEVICE_CONTROL
[60494 ms] UsbSnoop - MyDispatchInternalIOCTL(f78d6e80) : fdo=826b8a00, Irp=8268a7c0, IRQL=0
[60494 ms]  >>>  URB 48 going down  >>> 
-- URB_FUNCTION_BULK_OR_INTERRUPT_TRANSFER:
  PipeHandle           = 82a3d294 [endpoint 0x00000082]
  TransferFlags        = 00000003 (USBD_TRANSFER_DIRECTION_IN, USBD_SHORT_TRANSFER_OK)
  TransferBufferLength = 00000118
  TransferBuffer       = f7c39df8
  TransferBufferMDL    = 00000000
  UrbLink              = 00000000
[60494 ms] UsbSnoop - MyInternalIOCTLCompletion(f78d6db0) : fido=00000000, Irp=826a5cb0, Context=826c0910, IRQL=2
[60494 ms]  <<<  URB 47 coming back  <<< 
-- URB_FUNCTION_BULK_OR_INTERRUPT_TRANSFER:
  PipeHandle           = 82a3d2b4 [endpoint 0x00000002]
  TransferFlags        = 00000000 (USBD_TRANSFER_DIRECTION_OUT, ~USBD_SHORT_TRANSFER_OK)
  TransferBufferLength = 00000014
  TransferBuffer       = f7c2fca8
  TransferBufferMDL    = 82b37c48
  UrbLink              = 00000000
[60495 ms] UsbSnoop - MyInternalIOCTLCompletion(f78d6db0) : fido=00000000, Irp=8268a7c0, Context=826217c0, IRQL=2
[60495 ms]  <<<  URB 48 coming back  <<< 
-- URB_FUNCTION_BULK_OR_INTERRUPT_TRANSFER:
  PipeHandle           = 82a3d294 [endpoint 0x00000082]
  TransferFlags        = 00000003 (USBD_TRANSFER_DIRECTION_IN, USBD_SHORT_TRANSFER_OK)
  TransferBufferLength = 0000000c
  TransferBuffer       = f7c39df8
  TransferBufferMDL    = 82a30870
    00000000: 1b 13 00 02 00 00 00 0e 82 18 13 7e
  UrbLink              = 00000000
[60496 ms] UsbSnoop - DispatchAny(f78d5610) : IRP_MJ_INTERNAL_DEVICE_CONTROL
[60496 ms] UsbSnoop - MyDispatchInternalIOCTL(f78d6e80) : fdo=826b8a00, Irp=8268a7c0, IRQL=0
[60496 ms]  >>>  URB 49 going down  >>> 
-- URB_FUNCTION_BULK_OR_INTERRUPT_TRANSFER:
  PipeHandle           = 82a3d2b4 [endpoint 0x00000002]
  TransferFlags        = 00000000 (USBD_TRANSFER_DIRECTION_OUT, ~USBD_SHORT_TRANSFER_OK)
  TransferBufferLength = 0000000b
  TransferBuffer       = f7c37dc0
  TransferBufferMDL    = 00000000
    00000000: 1b 14 00 01 00 00 00 0e 13 c6 e9
  UrbLink              = 00000000
[60496 ms] UsbSnoop - DispatchAny(f78d5610) : IRP_MJ_INTERNAL_DEVICE_CONTROL
[60496 ms] UsbSnoop - MyDispatchInternalIOCTL(f78d6e80) : fdo=826b8a00, Irp=826a5cb0, IRQL=0
[60496 ms]  >>>  URB 50 going down  >>> 
-- URB_FUNCTION_BULK_OR_INTERRUPT_TRANSFER:
  PipeHandle           = 82a3d294 [endpoint 0x00000082]
  TransferFlags        = 00000003 (USBD_TRANSFER_DIRECTION_IN, USBD_SHORT_TRANSFER_OK)
  TransferBufferLength = 00000118
  TransferBuffer       = f7bfbdf8
  TransferBufferMDL    = 00000000
  UrbLink              = 00000000
[60496 ms] UsbSnoop - MyInternalIOCTLCompletion(f78d6db0) : fido=00000000, Irp=8268a7c0, Context=8269ee80, IRQL=2
[60496 ms]  <<<  URB 49 coming back  <<< 
-- URB_FUNCTION_BULK_OR_INTERRUPT_TRANSFER:
  PipeHandle           = 82a3d2b4 [endpoint 0x00000002]
  TransferFlags        = 00000000 (USBD_TRANSFER_DIRECTION_OUT, ~USBD_SHORT_TRANSFER_OK)
  TransferBufferLength = 0000000b
  TransferBuffer       = f7c37dc0
  TransferBufferMDL    = 82a30870
  UrbLink              = 00000000
[60505 ms] UsbSnoop - MyInternalIOCTLCompletion(f78d6db0) : fido=00000000, Irp=826a5cb0, Context=82a2e960, IRQL=2
[60505 ms]  <<<  URB 50 coming back  <<< 
-- URB_FUNCTION_BULK_OR_INTERRUPT_TRANSFER:
  PipeHandle           = 82a3d294 [endpoint 0x00000082]
  TransferFlags        = 00000003 (USBD_TRANSFER_DIRECTION_IN, USBD_SHORT_TRANSFER_OK)
  TransferBufferLength = 0000000b
  TransferBuffer       = f7bfbdf8
  TransferBufferMDL    = 82b37c48
    00000000: 1b 14 00 01 00 00 00 0e 80 d4 4f
  UrbLink              = 00000000
[60506 ms] UsbSnoop - DispatchAny(f78d5610) : IRP_MJ_INTERNAL_DEVICE_CONTROL
[60506 ms] UsbSnoop - MyDispatchInternalIOCTL(f78d6e80) : fdo=826b8a00, Irp=826a5cb0, IRQL=0
[60506 ms]  >>>  URB 51 going down  >>> 
-- URB_FUNCTION_BULK_OR_INTERRUPT_TRANSFER:
  PipeHandle           = 82a3d2b4 [endpoint 0x00000002]
  TransferFlags        = 00000000 (USBD_TRANSFER_DIRECTION_OUT, ~USBD_SHORT_TRANSFER_OK)
  TransferBufferLength = 00000094
  TransferBuffer       = f7c36608
  TransferBufferMDL    = 00000000
    00000000: 1b 15 00 8a 00 00 00 0e 04 b0 80 00 00 00 00 00
    00000010: 00 00 0c 94 2a 00 0c 94 47 00 0c 94 47 00 0c 94
    00000020: 47 00 0c 94 47 00 0c 94 47 00 0c 94 47 00 0c 94
    00000030: 47 00 0c 94 47 00 0c 94 47 00 0c 94 47 00 0c 94
    00000040: 47 00 0c 94 47 00 0c 94 47 00 0c 94 47 00 0c 94
    00000050: 47 00 0c 94 47 00 0c 94 47 00 0c 94 47 00 0c 94
    00000060: 47 00 0c 94 47 00 11 24 1f be cf e5 d8 e0 de bf
    00000070: cd bf 10 e0 a0 e6 b0 e0 e8 eb f0 e0 02 c0 05 90
    00000080: 0d 92 a0 36 b1 07 d9 f7 10 e0 a0 e6 b0 e0 01 c0
    00000090: 1d 92 4c 7d
  UrbLink              = 00000000
[60507 ms] UsbSnoop - DispatchAny(f78d5610) : IRP_MJ_INTERNAL_DEVICE_CONTROL
[60507 ms] UsbSnoop - MyDispatchInternalIOCTL(f78d6e80) : fdo=826b8a00, Irp=8268a7c0, IRQL=0
[60507 ms]  >>>  URB 52 going down  >>> 
-- URB_FUNCTION_BULK_OR_INTERRUPT_TRANSFER:
  PipeHandle           = 82a3d294 [endpoint 0x00000082]
  TransferFlags        = 00000003 (USBD_TRANSFER_DIRECTION_IN, USBD_SHORT_TRANSFER_OK)
  TransferBufferLength = 00000118
  TransferBuffer       = f7c45df8
  TransferBufferMDL    = 00000000
  UrbLink              = 00000000
[60507 ms] UsbSnoop - MyInternalIOCTLCompletion(f78d6db0) : fido=00000000, Irp=826a5cb0, Context=82afbd58, IRQL=2
[60507 ms]  <<<  URB 51 coming back  <<< 
-- URB_FUNCTION_BULK_OR_INTERRUPT_TRANSFER:
  PipeHandle           = 82a3d2b4 [endpoint 0x00000002]
  TransferFlags        = 00000000 (USBD_TRANSFER_DIRECTION_OUT, ~USBD_SHORT_TRANSFER_OK)
  TransferBufferLength = 00000094
  TransferBuffer       = f7c36608
  TransferBufferMDL    = 82b37c48
  UrbLink              = 00000000
[60515 ms] UsbSnoop - MyInternalIOCTLCompletion(f78d6db0) : fido=00000000, Irp=8268a7c0, Context=82ac3148, IRQL=2
[60515 ms]  <<<  URB 52 coming back  <<< 
-- URB_FUNCTION_BULK_OR_INTERRUPT_TRANSFER:
  PipeHandle           = 82a3d294 [endpoint 0x00000082]
  TransferFlags        = 00000003 (USBD_TRANSFER_DIRECTION_IN, USBD_SHORT_TRANSFER_OK)
  TransferBufferLength = 0000000b
  TransferBuffer       = f7c45df8
  TransferBufferMDL    = 82a30870
    00000000: 1b 15 00 01 00 00 00 0e 80 6b ce
  UrbLink              = 00000000
[60516 ms] UsbSnoop - DispatchAny(f78d5610) : IRP_MJ_INTERNAL_DEVICE_CONTROL
[60516 ms] UsbSnoop - MyDispatchInternalIOCTL(f78d6e80) : fdo=826b8a00, Irp=8268a7c0, IRQL=0
[60516 ms]  >>>  URB 53 going down  >>> 
-- URB_FUNCTION_BULK_OR_INTERRUPT_TRANSFER:
  PipeHandle           = 82a3d294 [endpoint 0x00000082]
  TransferFlags        = 00000003 (USBD_TRANSFER_DIRECTION_IN, USBD_SHORT_TRANSFER_OK)
  TransferBufferLength = 00000118
  TransferBuffer       = f7c5edf8
  TransferBufferMDL    = 00000000
  UrbLink              = 00000000
[60516 ms] UsbSnoop - DispatchAny(f78d5610) : IRP_MJ_INTERNAL_DEVICE_CONTROL
[60516 ms] UsbSnoop - MyDispatchInternalIOCTL(f78d6e80) : fdo=826b8a00, Irp=826a5cb0, IRQL=0
[60516 ms]  >>>  URB 54 going down  >>> 
-- URB_FUNCTION_BULK_OR_INTERRUPT_TRANSFER:
  PipeHandle           = 82a3d2b4 [endpoint 0x00000002]
  TransferFlags        = 00000000 (USBD_TRANSFER_DIRECTION_OUT, ~USBD_SHORT_TRANSFER_OK)
  TransferBufferLength = 00000094
  TransferBuffer       = f7c44608
  TransferBufferMDL    = 00000000
    00000000: 1b 16 00 8a 00 00 00 0e 04 b0 80 00 00 00 80 00
    00000010: 00 00 a0 36 b1 07 e1 f7 0e 94 49 00 0c 94 5b 00
    00000020: 0c 94 00 00 cf 93 df 93 cd b7 de b7 22 97 0f b6
    00000030: f8 94 de bf 0f be cd bf 1a 82 19 82 89 81 9a 81
    00000040: 08 96 9a 83 89 83 fa cf ff cf ff ff ff ff ff ff
    00000050: ff ff ff ff ff ff ff ff ff ff ff ff ff ff ff ff
    00000060: ff ff ff ff ff ff ff ff ff ff ff ff ff ff ff ff
    00000070: ff ff ff ff ff ff ff ff ff ff ff ff ff ff ff ff
    00000080: ff ff ff ff ff ff ff ff ff ff ff ff ff ff ff ff
    00000090: ff ff 3f 51
  UrbLink              = 00000000
[60516 ms] UsbSnoop - MyInternalIOCTLCompletion(f78d6db0) : fido=00000000, Irp=826a5cb0, Context=829d8560, IRQL=2
[60516 ms]  <<<  URB 54 coming back  <<< 
-- URB_FUNCTION_BULK_OR_INTERRUPT_TRANSFER:
  PipeHandle           = 82a3d2b4 [endpoint 0x00000002]
  TransferFlags        = 00000000 (USBD_TRANSFER_DIRECTION_OUT, ~USBD_SHORT_TRANSFER_OK)
  TransferBufferLength = 00000094
  TransferBuffer       = f7c44608
  TransferBufferMDL    = 82b37c48
  UrbLink              = 00000000
[60524 ms] UsbSnoop - MyInternalIOCTLCompletion(f78d6db0) : fido=00000000, Irp=8268a7c0, Context=826c0910, IRQL=2
[60524 ms]  <<<  URB 53 coming back  <<< 
-- URB_FUNCTION_BULK_OR_INTERRUPT_TRANSFER:
  PipeHandle           = 82a3d294 [endpoint 0x00000082]
  TransferFlags        = 00000003 (USBD_TRANSFER_DIRECTION_IN, USBD_SHORT_TRANSFER_OK)
  TransferBufferLength = 0000000b
  TransferBuffer       = f7c5edf8
  TransferBufferMDL    = 82a30870
    00000000: 1b 16 00 01 00 00 00 0e 80 bb 44
  UrbLink              = 00000000
[60525 ms] UsbSnoop - DispatchAny(f78d5610) : IRP_MJ_INTERNAL_DEVICE_CONTROL
[60525 ms] UsbSnoop - MyDispatchInternalIOCTL(f78d6e80) : fdo=826b8a00, Irp=8268a7c0, IRQL=0
[60525 ms]  >>>  URB 55 going down  >>> 
-- URB_FUNCTION_BULK_OR_INTERRUPT_TRANSFER:
  PipeHandle           = 82a3d2b4 [endpoint 0x00000002]
  TransferFlags        = 00000000 (USBD_TRANSFER_DIRECTION_OUT, ~USBD_SHORT_TRANSFER_OK)
  TransferBufferLength = 0000000b
  TransferBuffer       = f7c5cdc0
  TransferBufferMDL    = 00000000
    00000000: 1b 17 00 01 00 00 00 0e 15 20 06
  UrbLink              = 00000000
[60525 ms] UsbSnoop - DispatchAny(f78d5610) : IRP_MJ_INTERNAL_DEVICE_CONTROL
[60525 ms] UsbSnoop - MyDispatchInternalIOCTL(f78d6e80) : fdo=826b8a00, Irp=826a5cb0, IRQL=0
[60525 ms]  >>>  URB 56 going down  >>> 
-- URB_FUNCTION_BULK_OR_INTERRUPT_TRANSFER:
  PipeHandle           = 82a3d294 [endpoint 0x00000082]
  TransferFlags        = 00000003 (USBD_TRANSFER_DIRECTION_IN, USBD_SHORT_TRANSFER_OK)
  TransferBufferLength = 00000118
  TransferBuffer       = f7c60df8
  TransferBufferMDL    = 00000000
  UrbLink              = 00000000
[60525 ms] UsbSnoop - MyInternalIOCTLCompletion(f78d6db0) : fido=00000000, Irp=8268a7c0, Context=82b37cf8, IRQL=2
[60525 ms]  <<<  URB 55 coming back  <<< 
-- URB_FUNCTION_BULK_OR_INTERRUPT_TRANSFER:
  PipeHandle           = 82a3d2b4 [endpoint 0x00000002]
  TransferFlags        = 00000000 (USBD_TRANSFER_DIRECTION_OUT, ~USBD_SHORT_TRANSFER_OK)
  TransferBufferLength = 0000000b
  TransferBuffer       = f7c5cdc0
  TransferBufferMDL    = 82a30870
  UrbLink              = 00000000
[60526 ms] UsbSnoop - MyInternalIOCTLCompletion(f78d6db0) : fido=00000000, Irp=826a5cb0, Context=8269ee80, IRQL=2
[60526 ms]  <<<  URB 56 coming back  <<< 
-- URB_FUNCTION_BULK_OR_INTERRUPT_TRANSFER:
  PipeHandle           = 82a3d294 [endpoint 0x00000082]
  TransferFlags        = 00000003 (USBD_TRANSFER_DIRECTION_IN, USBD_SHORT_TRANSFER_OK)
  TransferBufferLength = 0000000b
  TransferBuffer       = f7c60df8
  TransferBufferMDL    = 82b37c48
    00000000: 1b 17 00 01 00 00 00 0e 80 04 c5
  UrbLink              = 00000000
[60527 ms] UsbSnoop - DispatchAny(f78d5610) : IRP_MJ_INTERNAL_DEVICE_CONTROL
[60527 ms] UsbSnoop - MyDispatchInternalIOCTL(f78d6e80) : fdo=826b8a00, Irp=826a5cb0, IRQL=0
[60527 ms]  >>>  URB 57 going down  >>> 
-- URB_FUNCTION_BULK_OR_INTERRUPT_TRANSFER:
  PipeHandle           = 82a3d2b4 [endpoint 0x00000002]
  TransferFlags        = 00000000 (USBD_TRANSFER_DIRECTION_OUT, ~USBD_SHORT_TRANSFER_OK)
  TransferBufferLength = 0000000d
  TransferBuffer       = f7c54dc0
  TransferBufferMDL    = 00000000
    00000000: 1b 18 00 03 00 00 00 0e 02 09 00 3e 3e
  UrbLink              = 00000000
[60527 ms] UsbSnoop - DispatchAny(f78d5610) : IRP_MJ_INTERNAL_DEVICE_CONTROL
[60527 ms] UsbSnoop - MyDispatchInternalIOCTL(f78d6e80) : fdo=826b8a00, Irp=8268a7c0, IRQL=0
[60527 ms]  >>>  URB 58 going down  >>> 
-- URB_FUNCTION_BULK_OR_INTERRUPT_TRANSFER:
  PipeHandle           = 82a3d294 [endpoint 0x00000082]
  TransferFlags        = 00000003 (USBD_TRANSFER_DIRECTION_IN, USBD_SHORT_TRANSFER_OK)
  TransferBufferLength = 00000118
  TransferBuffer       = f7c62df8
  TransferBufferMDL    = 00000000
  UrbLink              = 00000000
[60527 ms] UsbSnoop - MyInternalIOCTLCompletion(f78d6db0) : fido=00000000, Irp=826a5cb0, Context=82afbd58, IRQL=2
[60527 ms]  <<<  URB 57 coming back  <<< 
-- URB_FUNCTION_BULK_OR_INTERRUPT_TRANSFER:
  PipeHandle           = 82a3d2b4 [endpoint 0x00000002]
  TransferFlags        = 00000000 (USBD_TRANSFER_DIRECTION_OUT, ~USBD_SHORT_TRANSFER_OK)
  TransferBufferLength = 0000000d
  TransferBuffer       = f7c54dc0
  TransferBufferMDL    = 82b37c48
  UrbLink              = 00000000
[60528 ms] UsbSnoop - MyInternalIOCTLCompletion(f78d6db0) : fido=00000000, Irp=8268a7c0, Context=82a2e960, IRQL=2
[60528 ms]  <<<  URB 58 coming back  <<< 
-- URB_FUNCTION_BULK_OR_INTERRUPT_TRANSFER:
  PipeHandle           = 82a3d294 [endpoint 0x00000082]
  TransferFlags        = 00000003 (USBD_TRANSFER_DIRECTION_IN, USBD_SHORT_TRANSFER_OK)
  TransferBufferLength = 0000000b
  TransferBuffer       = f7c62df8
  TransferBufferMDL    = 82a30870
    00000000: 1b 18 00 01 00 00 00 0e 80 b6 74
  UrbLink              = 00000000
[60529 ms] UsbSnoop - DispatchAny(f78d5610) : IRP_MJ_INTERNAL_DEVICE_CONTROL
[60529 ms] UsbSnoop - MyDispatchInternalIOCTL(f78d6e80) : fdo=826b8a00, Irp=8268a7c0, IRQL=0
[60529 ms]  >>>  URB 59 going down  >>> 
-- URB_FUNCTION_BULK_OR_INTERRUPT_TRANSFER:
  PipeHandle           = 82a3d2b4 [endpoint 0x00000002]
  TransferFlags        = 00000000 (USBD_TRANSFER_DIRECTION_OUT, ~USBD_SHORT_TRANSFER_OK)
  TransferBufferLength = 00000020
  TransferBuffer       = f7c5d7c8
  TransferBufferMDL    = 00000000
    00000000: 1b 19 00 16 00 00 00 0e 04 61 0c 00 00 00 00 00
    00000010: 00 00 00 00 00 00 00 00 00 00 00 02 28 04 d5 c6
  UrbLink              = 00000000
[60529 ms] UsbSnoop - DispatchAny(f78d5610) : IRP_MJ_INTERNAL_DEVICE_CONTROL
[60529 ms] UsbSnoop - MyDispatchInternalIOCTL(f78d6e80) : fdo=826b8a00, Irp=826a5cb0, IRQL=0
[60529 ms]  >>>  URB 60 going down  >>> 
-- URB_FUNCTION_BULK_OR_INTERRUPT_TRANSFER:
  PipeHandle           = 82a3d294 [endpoint 0x00000082]
  TransferFlags        = 00000003 (USBD_TRANSFER_DIRECTION_IN, USBD_SHORT_TRANSFER_OK)
  TransferBufferLength = 00000118
  TransferBuffer       = f7c53df8
  TransferBufferMDL    = 00000000
  UrbLink              = 00000000
[60529 ms] UsbSnoop - MyInternalIOCTLCompletion(f78d6db0) : fido=00000000, Irp=8268a7c0, Context=829d8560, IRQL=2
[60529 ms]  <<<  URB 59 coming back  <<< 
-- URB_FUNCTION_BULK_OR_INTERRUPT_TRANSFER:
  PipeHandle           = 82a3d2b4 [endpoint 0x00000002]
  TransferFlags        = 00000000 (USBD_TRANSFER_DIRECTION_OUT, ~USBD_SHORT_TRANSFER_OK)
  TransferBufferLength = 00000020
  TransferBuffer       = f7c5d7c8
  TransferBufferMDL    = 82a30870
  UrbLink              = 00000000
[60530 ms] UsbSnoop - MyInternalIOCTLCompletion(f78d6db0) : fido=00000000, Irp=826a5cb0, Context=826217c0, IRQL=2
[60530 ms]  <<<  URB 60 coming back  <<< 
-- URB_FUNCTION_BULK_OR_INTERRUPT_TRANSFER:
  PipeHandle           = 82a3d294 [endpoint 0x00000082]
  TransferFlags        = 00000003 (USBD_TRANSFER_DIRECTION_IN, USBD_SHORT_TRANSFER_OK)
  TransferBufferLength = 0000000b
  TransferBuffer       = f7c53df8
  TransferBufferMDL    = 82b37c48
    00000000: 1b 19 00 01 00 00 00 0e 80 09 f5
  UrbLink              = 00000000
[60531 ms] UsbSnoop - DispatchAny(f78d5610) : IRP_MJ_INTERNAL_DEVICE_CONTROL
[60531 ms] UsbSnoop - MyDispatchInternalIOCTL(f78d6e80) : fdo=826b8a00, Irp=826a5cb0, IRQL=0
[60531 ms]  >>>  URB 61 going down  >>> 
-- URB_FUNCTION_BULK_OR_INTERRUPT_TRANSFER:
  PipeHandle           = 82a3d294 [endpoint 0x00000082]
  TransferFlags        = 00000003 (USBD_TRANSFER_DIRECTION_IN, USBD_SHORT_TRANSFER_OK)
  TransferBufferLength = 00000118
  TransferBuffer       = f7c63df8
  TransferBufferMDL    = 00000000
  UrbLink              = 00000000
[60553 ms] UsbSnoop - DispatchAny(f78d5610) : IRP_MJ_INTERNAL_DEVICE_CONTROL
[60553 ms] UsbSnoop - MyDispatchInternalIOCTL(f78d6e80) : fdo=826b8a00, Irp=8268a7c0, IRQL=0
[60553 ms]  >>>  URB 62 going down  >>> 
-- URB_FUNCTION_BULK_OR_INTERRUPT_TRANSFER:
  PipeHandle           = 82a3d2b4 [endpoint 0x00000002]
  TransferFlags        = 00000000 (USBD_TRANSFER_DIRECTION_OUT, ~USBD_SHORT_TRANSFER_OK)
  TransferBufferLength = 00000010
  TransferBuffer       = f7c6adc0
  TransferBufferMDL    = 00000000
    00000000: 1b 1a 00 06 00 00 00 0e 02 1f 49 00 00 00 95 da
  UrbLink              = 00000000
[60554 ms] UsbSnoop - MyInternalIOCTLCompletion(f78d6db0) : fido=00000000, Irp=826a5cb0, Context=829ea9d0, IRQL=2
[60554 ms]  <<<  URB 61 coming back  <<< 
-- URB_FUNCTION_BULK_OR_INTERRUPT_TRANSFER:
  PipeHandle           = 82a3d294 [endpoint 0x00000082]
  TransferFlags        = 00000003 (USBD_TRANSFER_DIRECTION_IN, USBD_SHORT_TRANSFER_OK)
  TransferBufferLength = 0000000b
  TransferBuffer       = f7c63df8
  TransferBufferMDL    = 82b37c48
    00000000: 1b 1a 00 01 00 00 00 0e 80 d9 7f
  UrbLink              = 00000000
[60554 ms] UsbSnoop - MyInternalIOCTLCompletion(f78d6db0) : fido=00000000, Irp=8268a7c0, Context=8269ee80, IRQL=2
[60554 ms]  <<<  URB 62 coming back  <<< 
-- URB_FUNCTION_BULK_OR_INTERRUPT_TRANSFER:
  PipeHandle           = 82a3d2b4 [endpoint 0x00000002]
  TransferFlags        = 00000000 (USBD_TRANSFER_DIRECTION_OUT, ~USBD_SHORT_TRANSFER_OK)
  TransferBufferLength = 00000010
  TransferBuffer       = f7c6adc0
  TransferBufferMDL    = 82a30870
  UrbLink              = 00000000
[60554 ms] UsbSnoop - DispatchAny(f78d5610) : IRP_MJ_INTERNAL_DEVICE_CONTROL
[60554 ms] UsbSnoop - MyDispatchInternalIOCTL(f78d6e80) : fdo=826b8a00, Irp=826ebb18, IRQL=0
[60554 ms]  >>>  URB 63 going down  >>> 
-- URB_FUNCTION_BULK_OR_INTERRUPT_TRANSFER:
  PipeHandle           = 82a3d294 [endpoint 0x00000082]
  TransferFlags        = 00000003 (USBD_TRANSFER_DIRECTION_IN, USBD_SHORT_TRANSFER_OK)
  TransferBufferLength = 00000118
  TransferBuffer       = f7c5bdf8
  TransferBufferMDL    = 00000000
  UrbLink              = 00000000
[60634 ms] UsbSnoop - DispatchAny(f78d5610) : IRP_MJ_INTERNAL_DEVICE_CONTROL
[60634 ms] UsbSnoop - MyDispatchInternalIOCTL(f78d6e80) : fdo=826b8a00, Irp=826a5cb0, IRQL=0
[60634 ms]  >>>  URB 64 going down  >>> 
-- URB_FUNCTION_BULK_OR_INTERRUPT_TRANSFER:
  PipeHandle           = 82a3d2b4 [endpoint 0x00000002]
  TransferFlags        = 00000000 (USBD_TRANSFER_DIRECTION_OUT, ~USBD_SHORT_TRANSFER_OK)
  TransferBufferLength = 00000010
  TransferBuffer       = f7c3f2f8
  TransferBufferMDL    = 00000000
    00000000: 1b 1b 00 06 00 00 00 0e 02 1f 49 00 00 00 38 df
  UrbLink              = 00000000
[60634 ms] UsbSnoop - MyInternalIOCTLCompletion(f78d6db0) : fido=00000000, Irp=826ebb18, Context=82afbd58, IRQL=2
[60634 ms]  <<<  URB 63 coming back  <<< 
-- URB_FUNCTION_BULK_OR_INTERRUPT_TRANSFER:
  PipeHandle           = 82a3d294 [endpoint 0x00000082]
  TransferFlags        = 00000003 (USBD_TRANSFER_DIRECTION_IN, USBD_SHORT_TRANSFER_OK)
  TransferBufferLength = 0000000b
  TransferBuffer       = f7c5bdf8
  TransferBufferMDL    = 82a30870
    00000000: 1b 1b 00 01 00 00 00 0e 80 66 fe
  UrbLink              = 00000000
[60635 ms] UsbSnoop - MyInternalIOCTLCompletion(f78d6db0) : fido=00000000, Irp=826a5cb0, Context=829ea9d0, IRQL=2
[60635 ms]  <<<  URB 64 coming back  <<< 
-- URB_FUNCTION_BULK_OR_INTERRUPT_TRANSFER:
  PipeHandle           = 82a3d2b4 [endpoint 0x00000002]
  TransferFlags        = 00000000 (USBD_TRANSFER_DIRECTION_OUT, ~USBD_SHORT_TRANSFER_OK)
  TransferBufferLength = 00000010
  TransferBuffer       = f7c3f2f8
  TransferBufferMDL    = 82b37c48
  UrbLink              = 00000000
[60635 ms] UsbSnoop - DispatchAny(f78d5610) : IRP_MJ_INTERNAL_DEVICE_CONTROL
[60635 ms] UsbSnoop - MyDispatchInternalIOCTL(f78d6e80) : fdo=826b8a00, Irp=8268a7c0, IRQL=0
[60635 ms]  >>>  URB 65 going down  >>> 
-- URB_FUNCTION_BULK_OR_INTERRUPT_TRANSFER:
  PipeHandle           = 82a3d2b4 [endpoint 0x00000002]
  TransferFlags        = 00000000 (USBD_TRANSFER_DIRECTION_OUT, ~USBD_SHORT_TRANSFER_OK)
  TransferBufferLength = 0000000d
  TransferBuffer       = f7c6b2f8
  TransferBufferMDL    = 00000000
    00000000: 1b 1c 00 03 00 00 00 0e 02 29 01 18 bc
  UrbLink              = 00000000
[60635 ms] UsbSnoop - DispatchAny(f78d5610) : IRP_MJ_INTERNAL_DEVICE_CONTROL
[60635 ms] UsbSnoop - MyDispatchInternalIOCTL(f78d6e80) : fdo=826b8a00, Irp=826ebb18, IRQL=0
[60635 ms]  >>>  URB 66 going down  >>> 
-- URB_FUNCTION_BULK_OR_INTERRUPT_TRANSFER:
  PipeHandle           = 82a3d294 [endpoint 0x00000082]
  TransferFlags        = 00000003 (USBD_TRANSFER_DIRECTION_IN, USBD_SHORT_TRANSFER_OK)
  TransferBufferLength = 00000118
  TransferBuffer       = f7c7ddf8
  TransferBufferMDL    = 00000000
  UrbLink              = 00000000
[60635 ms] UsbSnoop - MyInternalIOCTLCompletion(f78d6db0) : fido=00000000, Irp=8268a7c0, Context=8269df00, IRQL=2
[60635 ms]  <<<  URB 65 coming back  <<< 
-- URB_FUNCTION_BULK_OR_INTERRUPT_TRANSFER:
  PipeHandle           = 82a3d2b4 [endpoint 0x00000002]
  TransferFlags        = 00000000 (USBD_TRANSFER_DIRECTION_OUT, ~USBD_SHORT_TRANSFER_OK)
  TransferBufferLength = 0000000d
  TransferBuffer       = f7c6b2f8
  TransferBufferMDL    = 82b37c48
  UrbLink              = 00000000
[60636 ms] UsbSnoop - MyInternalIOCTLCompletion(f78d6db0) : fido=00000000, Irp=826ebb18, Context=826c0910, IRQL=2
[60636 ms]  <<<  URB 66 coming back  <<< 
-- URB_FUNCTION_BULK_OR_INTERRUPT_TRANSFER:
  PipeHandle           = 82a3d294 [endpoint 0x00000082]
  TransferFlags        = 00000003 (USBD_TRANSFER_DIRECTION_IN, USBD_SHORT_TRANSFER_OK)
  TransferBufferLength = 0000000b
  TransferBuffer       = f7c7ddf8
  TransferBufferMDL    = 82a30870
    00000000: 1b 1c 00 01 00 00 00 0e 80 68 62
  UrbLink              = 00000000
[60637 ms] UsbSnoop - DispatchAny(f78d5610) : IRP_MJ_INTERNAL_DEVICE_CONTROL
[60637 ms] UsbSnoop - MyDispatchInternalIOCTL(f78d6e80) : fdo=826b8a00, Irp=826ebb18, IRQL=0
[60637 ms]  >>>  URB 67 going down  >>> 
-- URB_FUNCTION_BULK_OR_INTERRUPT_TRANSFER:
  PipeHandle           = 82a3d2b4 [endpoint 0x00000002]
  TransferFlags        = 00000000 (USBD_TRANSFER_DIRECTION_OUT, ~USBD_SHORT_TRANSFER_OK)
  TransferBufferLength = 0000000c
  TransferBuffer       = f7c6e2f8
  TransferBufferMDL    = 00000000
    00000000: 1b 1d 00 02 00 00 00 0e 0b 02 c9 41
  UrbLink              = 00000000
[60637 ms] UsbSnoop - DispatchAny(f78d5610) : IRP_MJ_INTERNAL_DEVICE_CONTROL
[60637 ms] UsbSnoop - MyDispatchInternalIOCTL(f78d6e80) : fdo=826b8a00, Irp=8268a7c0, IRQL=0
[60637 ms]  >>>  URB 68 going down  >>> 
-- URB_FUNCTION_BULK_OR_INTERRUPT_TRANSFER:
  PipeHandle           = 82a3d294 [endpoint 0x00000082]
  TransferFlags        = 00000003 (USBD_TRANSFER_DIRECTION_IN, USBD_SHORT_TRANSFER_OK)
  TransferBufferLength = 00000118
  TransferBuffer       = f7c77df8
  TransferBufferMDL    = 00000000
  UrbLink              = 00000000
[60637 ms] UsbSnoop - MyInternalIOCTLCompletion(f78d6db0) : fido=00000000, Irp=826ebb18, Context=829d8560, IRQL=2
[60637 ms]  <<<  URB 67 coming back  <<< 
-- URB_FUNCTION_BULK_OR_INTERRUPT_TRANSFER:
  PipeHandle           = 82a3d2b4 [endpoint 0x00000002]
  TransferFlags        = 00000000 (USBD_TRANSFER_DIRECTION_OUT, ~USBD_SHORT_TRANSFER_OK)
  TransferBufferLength = 0000000c
  TransferBuffer       = f7c6e2f8
  TransferBufferMDL    = 82a30870
  UrbLink              = 00000000
[60697 ms] UsbSnoop - MyInternalIOCTLCompletion(f78d6db0) : fido=00000000, Irp=8268a7c0, Context=8264ecb8, IRQL=2
[60697 ms]  <<<  URB 68 coming back  <<< 
-- URB_FUNCTION_BULK_OR_INTERRUPT_TRANSFER:
  PipeHandle           = 82a3d294 [endpoint 0x00000082]
  TransferFlags        = 00000003 (USBD_TRANSFER_DIRECTION_IN, USBD_SHORT_TRANSFER_OK)
  TransferBufferLength = 0000000b
  TransferBuffer       = f7c77df8
  TransferBufferMDL    = 82b37c48
    00000000: 1b 1d 00 01 00 00 00 0e 80 d7 e3
  UrbLink              = 00000000
[60705 ms] UsbSnoop - DispatchAny(f78d5610) : IRP_MJ_INTERNAL_DEVICE_CONTROL
[60705 ms] UsbSnoop - MyDispatchInternalIOCTL(f78d6e80) : fdo=826b8a00, Irp=8268a7c0, IRQL=0
[60705 ms]  >>>  URB 69 going down  >>> 
-- URB_FUNCTION_BULK_OR_INTERRUPT_TRANSFER:
  PipeHandle           = 82a3d294 [endpoint 0x00000082]
  TransferFlags        = 00000003 (USBD_TRANSFER_DIRECTION_IN, USBD_SHORT_TRANSFER_OK)
  TransferBufferLength = 00000118
  TransferBuffer       = f7c7fdf8
  TransferBufferMDL    = 00000000
  UrbLink              = 00000000
[60804 ms] UsbSnoop - MyInternalIOCTLCompletion(f78d6db0) : fido=00000000, Irp=8268a7c0, Context=826217c0, IRQL=2
[60804 ms]  <<<  URB 69 coming back  <<< 
-- URB_FUNCTION_BULK_OR_INTERRUPT_TRANSFER:
  PipeHandle           = 82a3d294 [endpoint 0x00000082]
  TransferFlags        = 00000003 (USBD_TRANSFER_DIRECTION_IN, USBD_SHORT_TRANSFER_OK)
  TransferBufferLength = 00000010
  TransferBuffer       = f7c7fdf8
  TransferBufferMDL    = 82b37c48
    00000000: 1b ff ff 06 00 00 00 0e e0 49 00 00 00 00 08 bd
  UrbLink              = 00000000
[60804 ms] UsbSnoop - DispatchAny(f78d5610) : IRP_MJ_INTERNAL_DEVICE_CONTROL
[60804 ms] UsbSnoop - MyDispatchInternalIOCTL(f78d6e80) : fdo=826b8a00, Irp=8268a7c0, IRQL=0
[60804 ms]  >>>  URB 70 going down  >>> 
-- URB_FUNCTION_BULK_OR_INTERRUPT_TRANSFER:
  PipeHandle           = 82a3d294 [endpoint 0x00000082]
  TransferFlags        = 00000003 (USBD_TRANSFER_DIRECTION_IN, USBD_SHORT_TRANSFER_OK)
  TransferBufferLength = 00000118
  TransferBuffer       = f7b3fdf8
  TransferBufferMDL    = 00000000
  UrbLink              = 00000000
[61140 ms] UsbSnoop - DispatchAny(f78d5610) : IRP_MJ_INTERNAL_DEVICE_CONTROL
[61140 ms] UsbSnoop - MyDispatchInternalIOCTL(f78d6e80) : fdo=826b8a00, Irp=826ebb18, IRQL=0
[61140 ms]  >>>  URB 71 going down  >>> 
-- URB_FUNCTION_BULK_OR_INTERRUPT_TRANSFER:
  PipeHandle           = 82a3d2b4 [endpoint 0x00000002]
  TransferFlags        = 00000000 (USBD_TRANSFER_DIRECTION_OUT, ~USBD_SHORT_TRANSFER_OK)
  TransferBufferLength = 00000014
  TransferBuffer       = f7b35b48
  TransferBufferMDL    = 00000000
    00000000: 1b 1e 00 0a 00 00 00 0e 05 20 40 00 00 00 20 00
    00000010: 00 00 3a 3c
  UrbLink              = 00000000
[61141 ms] UsbSnoop - MyInternalIOCTLCompletion(f78d6db0) : fido=00000000, Irp=826ebb18, Context=826a8558, IRQL=2
[61141 ms]  <<<  URB 71 coming back  <<< 
-- URB_FUNCTION_BULK_OR_INTERRUPT_TRANSFER:
  PipeHandle           = 82a3d2b4 [endpoint 0x00000002]
  TransferFlags        = 00000000 (USBD_TRANSFER_DIRECTION_OUT, ~USBD_SHORT_TRANSFER_OK)
  TransferBufferLength = 00000014
  TransferBuffer       = f7b35b48
  TransferBufferMDL    = 82a30870
  UrbLink              = 00000000
[61206 ms] UsbSnoop - MyInternalIOCTLCompletion(f78d6db0) : fido=00000000, Irp=8268a7c0, Context=82afbd58, IRQL=2
[61206 ms]  <<<  URB 70 coming back  <<< 
-- URB_FUNCTION_BULK_OR_INTERRUPT_TRANSFER:
  PipeHandle           = 82a3d294 [endpoint 0x00000082]
  TransferFlags        = 00000003 (USBD_TRANSFER_DIRECTION_IN, USBD_SHORT_TRANSFER_OK)
  TransferBufferLength = 0000004b
  TransferBuffer       = f7b3fdf8
  TransferBufferMDL    = 82b37c48
    00000000: 1b 1e 00 41 00 00 00 0e 82 00 f8 fe ff 00 00 00
    00000010: 00 20 00 00 20 00 00 00 00 7f 00 00 c0 00 00 3f
    00000020: 00 00 ff 00 00 00 00 40 00 00 00 00 00 00 00 00
    00000030: 00 00 00 00 00 00 00 00 00 00 00 00 00 13 00 00
    00000040: 00 00 00 00 00 00 5d 08 02 57 f9
  UrbLink              = 00000000
[61206 ms] UsbSnoop - DispatchAny(f78d5610) : IRP_MJ_INTERNAL_DEVICE_CONTROL
[61206 ms] UsbSnoop - MyDispatchInternalIOCTL(f78d6e80) : fdo=826b8a00, Irp=8268a7c0, IRQL=0
[61206 ms]  >>>  URB 72 going down  >>> 
-- URB_FUNCTION_BULK_OR_INTERRUPT_TRANSFER:
  PipeHandle           = 82a3d294 [endpoint 0x00000082]
  TransferFlags        = 00000003 (USBD_TRANSFER_DIRECTION_IN, USBD_SHORT_TRANSFER_OK)
  TransferBufferLength = 00000118
  TransferBuffer       = f7b3adf8
  TransferBufferMDL    = 00000000
  UrbLink              = 00000000
[61206 ms] UsbSnoop - DispatchAny(f78d5610) : IRP_MJ_INTERNAL_DEVICE_CONTROL
[61206 ms] UsbSnoop - MyDispatchInternalIOCTL(f78d6e80) : fdo=826b8a00, Irp=826ebb18, IRQL=0
[61206 ms]  >>>  URB 73 going down  >>> 
-- URB_FUNCTION_BULK_OR_INTERRUPT_TRANSFER:
  PipeHandle           = 82a3d2b4 [endpoint 0x00000002]
  TransferFlags        = 00000000 (USBD_TRANSFER_DIRECTION_OUT, ~USBD_SHORT_TRANSFER_OK)
  TransferBufferLength = 00000014
  TransferBuffer       = f7b3db48
  TransferBufferMDL    = 00000000
    00000000: 1b 1f 00 0a 00 00 00 0e 05 20 20 00 00 00 00 00
    00000010: 00 00 67 70
  UrbLink              = 00000000
[61208 ms] UsbSnoop - MyInternalIOCTLCompletion(f78d6db0) : fido=00000000, Irp=826ebb18, Context=826c0910, IRQL=2
[61208 ms]  <<<  URB 73 coming back  <<< 
-- URB_FUNCTION_BULK_OR_INTERRUPT_TRANSFER:
  PipeHandle           = 82a3d2b4 [endpoint 0x00000002]
  TransferFlags        = 00000000 (USBD_TRANSFER_DIRECTION_OUT, ~USBD_SHORT_TRANSFER_OK)
  TransferBufferLength = 00000014
  TransferBuffer       = f7b3db48
  TransferBufferMDL    = 82a30870
  UrbLink              = 00000000
[61209 ms] UsbSnoop - MyInternalIOCTLCompletion(f78d6db0) : fido=00000000, Irp=8268a7c0, Context=8269ee80, IRQL=2
[61209 ms]  <<<  URB 72 coming back  <<< 
-- URB_FUNCTION_BULK_OR_INTERRUPT_TRANSFER:
  PipeHandle           = 82a3d294 [endpoint 0x00000082]
  TransferFlags        = 00000003 (USBD_TRANSFER_DIRECTION_IN, USBD_SHORT_TRANSFER_OK)
  TransferBufferLength = 0000002b
  TransferBuffer       = f7b3adf8
  TransferBufferMDL    = 82b37c48
    00000000: 1b 1f 00 21 00 00 00 0e 82 00 00 64 00 ef 00 ef
    00000010: 00 64 00 64 00 ff 08 42 00 00 00 08 00 64 00 cc
    00000020: 00 d0 de 60 00 5f 08 b8 00 62 25
  UrbLink              = 00000000
[61209 ms] UsbSnoop - DispatchAny(f78d5610) : IRP_MJ_INTERNAL_DEVICE_CONTROL
[61209 ms] UsbSnoop - MyDispatchInternalIOCTL(f78d6e80) : fdo=826b8a00, Irp=8268a7c0, IRQL=0
[61209 ms]  >>>  URB 74 going down  >>> 
-- URB_FUNCTION_BULK_OR_INTERRUPT_TRANSFER:
  PipeHandle           = 82a3d294 [endpoint 0x00000082]
  TransferFlags        = 00000003 (USBD_TRANSFER_DIRECTION_IN, USBD_SHORT_TRANSFER_OK)
  TransferBufferLength = 00000118
  TransferBuffer       = f7b42df8
  TransferBufferMDL    = 00000000
  UrbLink              = 00000000
[107070 ms] UsbSnoop - DispatchAny(f78d5610) : IRP_MJ_INTERNAL_DEVICE_CONTROL
[107070 ms] UsbSnoop - MyDispatchInternalIOCTL(f78d6e80) : fdo=826b8a00, Irp=82b3ccd8, IRQL=0
[107070 ms]  >>>  URB 75 going down  >>> 
-- URB_FUNCTION_BULK_OR_INTERRUPT_TRANSFER:
  PipeHandle           = 82a3d2b4 [endpoint 0x00000002]
  TransferFlags        = 00000000 (USBD_TRANSFER_DIRECTION_OUT, ~USBD_SHORT_TRANSFER_OK)
  TransferBufferLength = 0000000d
  TransferBuffer       = f7c5dc18
  TransferBufferMDL    = 00000000
    00000000: 1b 20 00 03 00 00 00 0e 02 29 00 c3 0a
  UrbLink              = 00000000
[107071 ms] UsbSnoop - MyInternalIOCTLCompletion(f78d6db0) : fido=00000000, Irp=82b3ccd8, Context=82a82620, IRQL=2
[107071 ms]  <<<  URB 75 coming back  <<< 
-- URB_FUNCTION_BULK_OR_INTERRUPT_TRANSFER:
  PipeHandle           = 82a3d2b4 [endpoint 0x00000002]
  TransferFlags        = 00000000 (USBD_TRANSFER_DIRECTION_OUT, ~USBD_SHORT_TRANSFER_OK)
  TransferBufferLength = 0000000d
  TransferBuffer       = f7c5dc18
  TransferBufferMDL    = 82616d58
  UrbLink              = 00000000
[107072 ms] UsbSnoop - MyInternalIOCTLCompletion(f78d6db0) : fido=00000000, Irp=8268a7c0, Context=829d8560, IRQL=2
[107072 ms]  <<<  URB 74 coming back  <<< 
-- URB_FUNCTION_BULK_OR_INTERRUPT_TRANSFER:
  PipeHandle           = 82a3d294 [endpoint 0x00000082]
  TransferFlags        = 00000003 (USBD_TRANSFER_DIRECTION_IN, USBD_SHORT_TRANSFER_OK)
  TransferBufferLength = 0000000b
  TransferBuffer       = f7b42df8
  TransferBufferMDL    = 82b37c48
    00000000: 1b 20 00 01 00 00 00 0e 80 82 b4
  UrbLink              = 00000000
[107072 ms] UsbSnoop - DispatchAny(f78d5610) : IRP_MJ_INTERNAL_DEVICE_CONTROL
[107072 ms] UsbSnoop - MyDispatchInternalIOCTL(f78d6e80) : fdo=826b8a00, Irp=826a5b18, IRQL=0
[107072 ms]  >>>  URB 76 going down  >>> 
-- URB_FUNCTION_BULK_OR_INTERRUPT_TRANSFER:
  PipeHandle           = 82a3d2b4 [endpoint 0x00000002]
  TransferFlags        = 00000000 (USBD_TRANSFER_DIRECTION_OUT, ~USBD_SHORT_TRANSFER_OK)
  TransferBufferLength = 0000000b
  TransferBuffer       = f7c64c18
  TransferBufferMDL    = 00000000
    00000000: 1b 21 00 01 00 00 00 0e 08 7d 3d
  UrbLink              = 00000000
[107073 ms] UsbSnoop - DispatchAny(f78d5610) : IRP_MJ_INTERNAL_DEVICE_CONTROL
[107073 ms] UsbSnoop - MyDispatchInternalIOCTL(f78d6e80) : fdo=826b8a00, Irp=826a7a20, IRQL=0
[107073 ms]  >>>  URB 77 going down  >>> 
-- URB_FUNCTION_BULK_OR_INTERRUPT_TRANSFER:
  PipeHandle           = 82a3d294 [endpoint 0x00000082]
  TransferFlags        = 00000003 (USBD_TRANSFER_DIRECTION_IN, USBD_SHORT_TRANSFER_OK)
  TransferBufferLength = 00000118
  TransferBuffer       = f7c50df8
  TransferBufferMDL    = 00000000
  UrbLink              = 00000000
[107073 ms] UsbSnoop - MyInternalIOCTLCompletion(f78d6db0) : fido=00000000, Irp=826a5b18, Context=825fe228, IRQL=2
[107073 ms]  <<<  URB 76 coming back  <<< 
-- URB_FUNCTION_BULK_OR_INTERRUPT_TRANSFER:
  PipeHandle           = 82a3d2b4 [endpoint 0x00000002]
  TransferFlags        = 00000000 (USBD_TRANSFER_DIRECTION_OUT, ~USBD_SHORT_TRANSFER_OK)
  TransferBufferLength = 0000000b
  TransferBuffer       = f7c64c18
  TransferBufferMDL    = 82b37c48
  UrbLink              = 00000000
[107093 ms] UsbSnoop - MyInternalIOCTLCompletion(f78d6db0) : fido=00000000, Irp=826a7a20, Context=829d5d80, IRQL=2
[107093 ms]  <<<  URB 77 coming back  <<< 
-- URB_FUNCTION_BULK_OR_INTERRUPT_TRANSFER:
  PipeHandle           = 82a3d294 [endpoint 0x00000082]
  TransferFlags        = 00000003 (USBD_TRANSFER_DIRECTION_IN, USBD_SHORT_TRANSFER_OK)
  TransferBufferLength = 0000000b
  TransferBuffer       = f7c50df8
  TransferBufferMDL    = 82616d58
    00000000: 1b 21 00 01 00 00 00 0e 80 3d 35
  UrbLink              = 00000000
[107122 ms] UsbSnoop - DispatchAny(f78d5610) : IRP_MJ_INTERNAL_DEVICE_CONTROL
[107122 ms] UsbSnoop - MyDispatchInternalIOCTL(f78d6e80) : fdo=826b8a00, Irp=826a7a20, IRQL=0
[107122 ms]  >>>  URB 78 going down  >>> 
-- URB_FUNCTION_BULK_OR_INTERRUPT_TRANSFER:
  PipeHandle           = 82a3d294 [endpoint 0x00000082]
  TransferFlags        = 00000003 (USBD_TRANSFER_DIRECTION_IN, USBD_SHORT_TRANSFER_OK)
  TransferBufferLength = 00000118
  TransferBuffer       = f7c63df8
  TransferBufferMDL    = 00000000
  UrbLink              = 00000000
[111271 ms] UsbSnoop - DispatchAny(f78d5610) : IRP_MJ_INTERNAL_DEVICE_CONTROL
[111271 ms] UsbSnoop - MyDispatchInternalIOCTL(f78d6e80) : fdo=826b8a00, Irp=8268a7c0, IRQL=0
[111271 ms]  >>>  URB 79 going down  >>> 
-- URB_FUNCTION_BULK_OR_INTERRUPT_TRANSFER:
  PipeHandle           = 82a3d2b4 [endpoint 0x00000002]
  TransferFlags        = 00000000 (USBD_TRANSFER_DIRECTION_OUT, ~USBD_SHORT_TRANSFER_OK)
  TransferBufferLength = 0000000c
  TransferBuffer       = f7c08c18
  TransferBufferMDL    = 00000000
    00000000: 1b 22 00 02 00 00 00 0e 0a 02 94 c6
  UrbLink              = 00000000
[111272 ms] UsbSnoop - MyInternalIOCTLCompletion(f78d6db0) : fido=00000000, Irp=8268a7c0, Context=82afb930, IRQL=2
[111272 ms]  <<<  URB 79 coming back  <<< 
-- URB_FUNCTION_BULK_OR_INTERRUPT_TRANSFER:
  PipeHandle           = 82a3d2b4 [endpoint 0x00000002]
  TransferFlags        = 00000000 (USBD_TRANSFER_DIRECTION_OUT, ~USBD_SHORT_TRANSFER_OK)
  TransferBufferLength = 0000000c
  TransferBuffer       = f7c08c18
  TransferBufferMDL    = 82b37c48
  UrbLink              = 00000000
[111284 ms] UsbSnoop - MyInternalIOCTLCompletion(f78d6db0) : fido=00000000, Irp=826a7a20, Context=82a48838, IRQL=2
[111284 ms]  <<<  URB 78 coming back  <<< 
-- URB_FUNCTION_BULK_OR_INTERRUPT_TRANSFER:
  PipeHandle           = 82a3d294 [endpoint 0x00000082]
  TransferFlags        = 00000003 (USBD_TRANSFER_DIRECTION_IN, USBD_SHORT_TRANSFER_OK)
  TransferBufferLength = 0000000b
  TransferBuffer       = f7c63df8
  TransferBufferMDL    = 82616d58
    00000000: 1b 22 00 01 00 00 00 0e 80 ed bf
  UrbLink              = 00000000
[111298 ms] UsbSnoop - DispatchAny(f78d5610) : IRP_MJ_INTERNAL_DEVICE_CONTROL
[111298 ms] UsbSnoop - MyDispatchInternalIOCTL(f78d6e80) : fdo=826b8a00, Irp=828a1c98, IRQL=0
[111298 ms]  >>>  URB 80 going down  >>> 
-- URB_FUNCTION_BULK_OR_INTERRUPT_TRANSFER:
  PipeHandle           = 82a3d294 [endpoint 0x00000082]
  TransferFlags        = 00000003 (USBD_TRANSFER_DIRECTION_IN, USBD_SHORT_TRANSFER_OK)
  TransferBufferLength = 00000118
  TransferBuffer       = f7c0bdf8
  TransferBufferMDL    = 00000000
  UrbLink              = 00000000
[111315 ms] UsbSnoop - MyInternalIOCTLCompletion(f78d6db0) : fido=00000000, Irp=828a1c98, Context=829d5d80, IRQL=2
[111315 ms]  <<<  URB 80 coming back  <<< 
-- URB_FUNCTION_BULK_OR_INTERRUPT_TRANSFER:
  PipeHandle           = 82a3d294 [endpoint 0x00000082]
  TransferFlags        = 00000003 (USBD_TRANSFER_DIRECTION_IN, USBD_SHORT_TRANSFER_OK)
  TransferBufferLength = 00000010
  TransferBuffer       = f7c0bdf8
  TransferBufferMDL    = 82616d58
    00000000: 1b ff ff 06 00 00 00 0e e0 5a 00 00 00 00 84 14
  UrbLink              = 00000000
[111318 ms] UsbSnoop - DispatchAny(f78d5610) : IRP_MJ_INTERNAL_DEVICE_CONTROL
[111318 ms] UsbSnoop - MyDispatchInternalIOCTL(f78d6e80) : fdo=826b8a00, Irp=828a1c98, IRQL=0
[111318 ms]  >>>  URB 81 going down  >>> 
-- URB_FUNCTION_BULK_OR_INTERRUPT_TRANSFER:
  PipeHandle           = 82a3d294 [endpoint 0x00000082]
  TransferFlags        = 00000003 (USBD_TRANSFER_DIRECTION_IN, USBD_SHORT_TRANSFER_OK)
  TransferBufferLength = 00000118
  TransferBuffer       = f7c2ddf8
  TransferBufferMDL    = 00000000
  UrbLink              = 00000000
[111334 ms] UsbSnoop - DispatchAny(f78d5610) : IRP_MJ_INTERNAL_DEVICE_CONTROL
[111334 ms] UsbSnoop - MyDispatchInternalIOCTL(f78d6e80) : fdo=826b8a00, Irp=826a5b18, IRQL=0
[111334 ms]  >>>  URB 82 going down  >>> 
-- URB_FUNCTION_BULK_OR_INTERRUPT_TRANSFER:
  PipeHandle           = 82a3d2b4 [endpoint 0x00000002]
  TransferFlags        = 00000000 (USBD_TRANSFER_DIRECTION_OUT, ~USBD_SHORT_TRANSFER_OK)
  TransferBufferLength = 00000014
  TransferBuffer       = f7c35b48
  TransferBufferMDL    = 00000000
    00000000: 1b 23 00 0a 00 00 00 0e 05 20 40 00 00 00 20 00
    00000010: 00 00 52 f5
  UrbLink              = 00000000
[111335 ms] UsbSnoop - MyInternalIOCTLCompletion(f78d6db0) : fido=00000000, Irp=826a5b18, Context=829dff08, IRQL=2
[111335 ms]  <<<  URB 82 coming back  <<< 
-- URB_FUNCTION_BULK_OR_INTERRUPT_TRANSFER:
  PipeHandle           = 82a3d2b4 [endpoint 0x00000002]
  TransferFlags        = 00000000 (USBD_TRANSFER_DIRECTION_OUT, ~USBD_SHORT_TRANSFER_OK)
  TransferBufferLength = 00000014
  TransferBuffer       = f7c35b48
  TransferBufferMDL    = 82b37c48
  UrbLink              = 00000000
[111400 ms] UsbSnoop - MyInternalIOCTLCompletion(f78d6db0) : fido=00000000, Irp=828a1c98, Context=82a82620, IRQL=2
[111400 ms]  <<<  URB 81 coming back  <<< 
-- URB_FUNCTION_BULK_OR_INTERRUPT_TRANSFER:
  PipeHandle           = 82a3d294 [endpoint 0x00000082]
  TransferFlags        = 00000003 (USBD_TRANSFER_DIRECTION_IN, USBD_SHORT_TRANSFER_OK)
  TransferBufferLength = 0000004b
  TransferBuffer       = f7c2ddf8
  TransferBufferMDL    = 82616d58
    00000000: 1b 23 00 41 00 00 00 0e 82 00 f8 fe ff 00 00 00
    00000010: 00 20 00 00 20 00 00 00 00 7f 00 00 c0 00 00 3f
    00000020: 00 00 ff 00 00 00 00 40 00 00 00 00 00 00 00 00
    00000030: 00 00 00 00 00 00 00 00 00 00 00 00 00 13 00 00
    00000040: 00 00 00 00 00 00 59 08 00 0f 56
  UrbLink              = 00000000
[111400 ms] UsbSnoop - DispatchAny(f78d5610) : IRP_MJ_INTERNAL_DEVICE_CONTROL
[111400 ms] UsbSnoop - MyDispatchInternalIOCTL(f78d6e80) : fdo=826b8a00, Irp=828a1c98, IRQL=0
[111400 ms]  >>>  URB 83 going down  >>> 
-- URB_FUNCTION_BULK_OR_INTERRUPT_TRANSFER:
  PipeHandle           = 82a3d2b4 [endpoint 0x00000002]
  TransferFlags        = 00000000 (USBD_TRANSFER_DIRECTION_OUT, ~USBD_SHORT_TRANSFER_OK)
  TransferBufferLength = 00000014
  TransferBuffer       = f7c2cb48
  TransferBufferMDL    = 00000000
    00000000: 1b 24 00 0a 00 00 00 0e 05 20 20 00 00 00 00 00
    00000010: 00 00 2d d9
  UrbLink              = 00000000
[111401 ms] UsbSnoop - DispatchAny(f78d5610) : IRP_MJ_INTERNAL_DEVICE_CONTROL
[111401 ms] UsbSnoop - MyDispatchInternalIOCTL(f78d6e80) : fdo=826b8a00, Irp=826a5b18, IRQL=0
[111401 ms]  >>>  URB 84 going down  >>> 
-- URB_FUNCTION_BULK_OR_INTERRUPT_TRANSFER:
  PipeHandle           = 82a3d294 [endpoint 0x00000082]
  TransferFlags        = 00000003 (USBD_TRANSFER_DIRECTION_IN, USBD_SHORT_TRANSFER_OK)
  TransferBufferLength = 00000118
  TransferBuffer       = f7c29df8
  TransferBufferMDL    = 00000000
  UrbLink              = 00000000
[111401 ms] UsbSnoop - MyInternalIOCTLCompletion(f78d6db0) : fido=00000000, Irp=828a1c98, Context=826c3148, IRQL=2
[111401 ms]  <<<  URB 83 coming back  <<< 
-- URB_FUNCTION_BULK_OR_INTERRUPT_TRANSFER:
  PipeHandle           = 82a3d2b4 [endpoint 0x00000002]
  TransferFlags        = 00000000 (USBD_TRANSFER_DIRECTION_OUT, ~USBD_SHORT_TRANSFER_OK)
  TransferBufferLength = 00000014
  TransferBuffer       = f7c2cb48
  TransferBufferMDL    = 82616d58
  UrbLink              = 00000000
[111403 ms] UsbSnoop - MyInternalIOCTLCompletion(f78d6db0) : fido=00000000, Irp=826a5b18, Context=829ea9d0, IRQL=2
[111403 ms]  <<<  URB 84 coming back  <<< 
-- URB_FUNCTION_BULK_OR_INTERRUPT_TRANSFER:
  PipeHandle           = 82a3d294 [endpoint 0x00000082]
  TransferFlags        = 00000003 (USBD_TRANSFER_DIRECTION_IN, USBD_SHORT_TRANSFER_OK)
  TransferBufferLength = 0000002b
  TransferBuffer       = f7c29df8
  TransferBufferMDL    = 82b37c48
    00000000: 1b 24 00 21 00 00 00 0e 82 00 00 64 00 ef 00 ef
    00000010: 00 64 00 64 00 ff 08 42 00 00 00 08 00 64 00 cc
    00000020: 00 30 17 60 00 59 08 b8 00 56 39
  UrbLink              = 00000000
[111412 ms] UsbSnoop - DispatchAny(f78d5610) : IRP_MJ_INTERNAL_DEVICE_CONTROL
[111412 ms] UsbSnoop - MyDispatchInternalIOCTL(f78d6e80) : fdo=826b8a00, Irp=826a5b18, IRQL=0
[111412 ms]  >>>  URB 85 going down  >>> 
-- URB_FUNCTION_BULK_OR_INTERRUPT_TRANSFER:
  PipeHandle           = 82a3d294 [endpoint 0x00000082]
  TransferFlags        = 00000003 (USBD_TRANSFER_DIRECTION_IN, USBD_SHORT_TRANSFER_OK)
  TransferBufferLength = 00000118
  TransferBuffer       = f7c3edf8
  TransferBufferMDL    = 00000000
  UrbLink              = 00000000
[114068 ms] UsbSnoop - DispatchAny(f78d5610) : IRP_MJ_INTERNAL_DEVICE_CONTROL
[114068 ms] UsbSnoop - MyDispatchInternalIOCTL(f78d6e80) : fdo=826b8a00, Irp=828a1c98, IRQL=0
[114068 ms]  >>>  URB 86 going down  >>> 
-- URB_FUNCTION_BULK_OR_INTERRUPT_TRANSFER:
  PipeHandle           = 82a3d2b4 [endpoint 0x00000002]
  TransferFlags        = 00000000 (USBD_TRANSFER_DIRECTION_OUT, ~USBD_SHORT_TRANSFER_OK)
  TransferBufferLength = 0000000b
  TransferBuffer       = f7b30c18
  TransferBufferMDL    = 00000000
    00000000: 1b 25 00 01 00 00 00 0e 08 a3 2b
  UrbLink              = 00000000
[114068 ms] UsbSnoop - MyInternalIOCTLCompletion(f78d6db0) : fido=00000000, Irp=828a1c98, Context=8264d2f0, IRQL=2
[114068 ms]  <<<  URB 86 coming back  <<< 
-- URB_FUNCTION_BULK_OR_INTERRUPT_TRANSFER:
  PipeHandle           = 82a3d2b4 [endpoint 0x00000002]
  TransferFlags        = 00000000 (USBD_TRANSFER_DIRECTION_OUT, ~USBD_SHORT_TRANSFER_OK)
  TransferBufferLength = 0000000b
  TransferBuffer       = f7b30c18
  TransferBufferMDL    = 82616d58
  UrbLink              = 00000000
[114088 ms] UsbSnoop - MyInternalIOCTLCompletion(f78d6db0) : fido=00000000, Irp=826a5b18, Context=82603210, IRQL=2
[114088 ms]  <<<  URB 85 coming back  <<< 
-- URB_FUNCTION_BULK_OR_INTERRUPT_TRANSFER:
  PipeHandle           = 82a3d294 [endpoint 0x00000082]
  TransferFlags        = 00000003 (USBD_TRANSFER_DIRECTION_IN, USBD_SHORT_TRANSFER_OK)
  TransferBufferLength = 0000000b
  TransferBuffer       = f7c3edf8
  TransferBufferMDL    = 82b37c48
    00000000: 1b 25 00 01 00 00 00 0e 80 e3 23
  UrbLink              = 00000000
[114089 ms] UsbSnoop - DispatchAny(f78d5610) : IRP_MJ_INTERNAL_DEVICE_CONTROL
[114089 ms] UsbSnoop - MyDispatchInternalIOCTL(f78d6e80) : fdo=826b8a00, Irp=826a7a20, IRQL=0
[114089 ms]  >>>  URB 87 going down  >>> 
-- URB_FUNCTION_BULK_OR_INTERRUPT_TRANSFER:
  PipeHandle           = 82a3d294 [endpoint 0x00000082]
  TransferFlags        = 00000003 (USBD_TRANSFER_DIRECTION_IN, USBD_SHORT_TRANSFER_OK)
  TransferBufferLength = 00000118
  TransferBuffer       = f7c75df8
  TransferBufferMDL    = 00000000
  UrbLink              = 00000000
[115479 ms] UsbSnoop - DispatchAny(f78d5610) : IRP_MJ_INTERNAL_DEVICE_CONTROL
[115479 ms] UsbSnoop - MyDispatchInternalIOCTL(f78d6e80) : fdo=826b8a00, Irp=82a5b5f8, IRQL=0
[115479 ms]  >>>  URB 88 going down  >>> 
-- URB_FUNCTION_BULK_OR_INTERRUPT_TRANSFER:
  PipeHandle           = 82a3d2b4 [endpoint 0x00000002]
  TransferFlags        = 00000000 (USBD_TRANSFER_DIRECTION_OUT, ~USBD_SHORT_TRANSFER_OK)
  TransferBufferLength = 0000000c
  TransferBuffer       = f7bc9c18
  TransferBufferMDL    = 00000000
    00000000: 1b 26 00 02 00 00 00 0e 0a 02 71 f9
  UrbLink              = 00000000
[115480 ms] UsbSnoop - MyInternalIOCTLCompletion(f78d6db0) : fido=00000000, Irp=82a5b5f8, Context=82afb930, IRQL=2
[115480 ms]  <<<  URB 88 coming back  <<< 
-- URB_FUNCTION_BULK_OR_INTERRUPT_TRANSFER:
  PipeHandle           = 82a3d2b4 [endpoint 0x00000002]
  TransferFlags        = 00000000 (USBD_TRANSFER_DIRECTION_OUT, ~USBD_SHORT_TRANSFER_OK)
  TransferBufferLength = 0000000c
  TransferBuffer       = f7bc9c18
  TransferBufferMDL    = 82616d58
  UrbLink              = 00000000
[115520 ms] UsbSnoop - MyInternalIOCTLCompletion(f78d6db0) : fido=00000000, Irp=826a7a20, Context=828331d8, IRQL=2
[115520 ms]  <<<  URB 87 coming back  <<< 
-- URB_FUNCTION_BULK_OR_INTERRUPT_TRANSFER:
  PipeHandle           = 82a3d294 [endpoint 0x00000082]
  TransferFlags        = 00000003 (USBD_TRANSFER_DIRECTION_IN, USBD_SHORT_TRANSFER_OK)
  TransferBufferLength = 0000000b
  TransferBuffer       = f7c75df8
  TransferBufferMDL    = 82b37c48
    00000000: 1b 26 00 01 00 00 00 0e 80 33 a9
  UrbLink              = 00000000
[115520 ms] UsbSnoop - DispatchAny(f78d5610) : IRP_MJ_INTERNAL_DEVICE_CONTROL
[115520 ms] UsbSnoop - MyDispatchInternalIOCTL(f78d6e80) : fdo=826b8a00, Irp=826a7a20, IRQL=0
[115520 ms]  >>>  URB 89 going down  >>> 
-- URB_FUNCTION_BULK_OR_INTERRUPT_TRANSFER:
  PipeHandle           = 82a3d294 [endpoint 0x00000082]
  TransferFlags        = 00000003 (USBD_TRANSFER_DIRECTION_IN, USBD_SHORT_TRANSFER_OK)
  TransferBufferLength = 00000118
  TransferBuffer       = f7baedf8
  TransferBufferMDL    = 00000000
  UrbLink              = 00000000
[115528 ms] UsbSnoop - MyInternalIOCTLCompletion(f78d6db0) : fido=00000000, Irp=826a7a20, Context=8264d2f0, IRQL=2
[115528 ms]  <<<  URB 89 coming back  <<< 
-- URB_FUNCTION_BULK_OR_INTERRUPT_TRANSFER:
  PipeHandle           = 82a3d294 [endpoint 0x00000082]
  TransferFlags        = 00000003 (USBD_TRANSFER_DIRECTION_IN, USBD_SHORT_TRANSFER_OK)
  TransferBufferLength = 00000010
  TransferBuffer       = f7baedf8
  TransferBufferMDL    = 82b37c48
    00000000: 1b ff ff 06 00 00 00 0e e0 5a 00 00 00 00 84 14
  UrbLink              = 00000000
[115530 ms] UsbSnoop - DispatchAny(f78d5610) : IRP_MJ_INTERNAL_DEVICE_CONTROL
[115530 ms] UsbSnoop - MyDispatchInternalIOCTL(f78d6e80) : fdo=826b8a00, Irp=826a7a20, IRQL=0
[115530 ms]  >>>  URB 90 going down  >>> 
-- URB_FUNCTION_BULK_OR_INTERRUPT_TRANSFER:
  PipeHandle           = 82a3d294 [endpoint 0x00000082]
  TransferFlags        = 00000003 (USBD_TRANSFER_DIRECTION_IN, USBD_SHORT_TRANSFER_OK)
  TransferBufferLength = 00000118
  TransferBuffer       = f7b4adf8
  TransferBufferMDL    = 00000000
  UrbLink              = 00000000
[115545 ms] UsbSnoop - DispatchAny(f78d5610) : IRP_MJ_INTERNAL_DEVICE_CONTROL
[115545 ms] UsbSnoop - MyDispatchInternalIOCTL(f78d6e80) : fdo=826b8a00, Irp=82a5b5f8, IRQL=0
[115545 ms]  >>>  URB 91 going down  >>> 
-- URB_FUNCTION_BULK_OR_INTERRUPT_TRANSFER:
  PipeHandle           = 82a3d2b4 [endpoint 0x00000002]
  TransferFlags        = 00000000 (USBD_TRANSFER_DIRECTION_OUT, ~USBD_SHORT_TRANSFER_OK)
  TransferBufferLength = 00000014
  TransferBuffer       = f7bd4b48
  TransferBufferMDL    = 00000000
    00000000: 1b 27 00 0a 00 00 00 0e 05 20 40 00 00 00 20 00
    00000010: 00 00 6e b5
  UrbLink              = 00000000
[115546 ms] UsbSnoop - MyInternalIOCTLCompletion(f78d6db0) : fido=00000000, Irp=82a5b5f8, Context=82ac3148, IRQL=2
[115546 ms]  <<<  URB 91 coming back  <<< 
-- URB_FUNCTION_BULK_OR_INTERRUPT_TRANSFER:
  PipeHandle           = 82a3d2b4 [endpoint 0x00000002]
  TransferFlags        = 00000000 (USBD_TRANSFER_DIRECTION_OUT, ~USBD_SHORT_TRANSFER_OK)
  TransferBufferLength = 00000014
  TransferBuffer       = f7bd4b48
  TransferBufferMDL    = 82617d58
  UrbLink              = 00000000
[115612 ms] UsbSnoop - MyInternalIOCTLCompletion(f78d6db0) : fido=00000000, Irp=826a7a20, Context=82a48838, IRQL=2
[115612 ms]  <<<  URB 90 coming back  <<< 
-- URB_FUNCTION_BULK_OR_INTERRUPT_TRANSFER:
  PipeHandle           = 82a3d294 [endpoint 0x00000082]
  TransferFlags        = 00000003 (USBD_TRANSFER_DIRECTION_IN, USBD_SHORT_TRANSFER_OK)
  TransferBufferLength = 0000004b
  TransferBuffer       = f7b4adf8
  TransferBufferMDL    = 82b37c48
    00000000: 1b 27 00 41 00 00 00 0e 82 00 f8 fe ff 00 00 00
    00000010: 00 20 00 00 20 00 00 00 00 7f 00 00 c0 00 00 3f
    00000020: 00 00 ff 00 00 00 00 40 00 00 00 00 00 00 00 00
    00000030: 00 00 00 00 00 00 00 00 00 00 00 00 00 13 00 00
    00000040: 00 00 00 00 00 00 59 08 14 a2 21
  UrbLink              = 00000000
[115612 ms] UsbSnoop - DispatchAny(f78d5610) : IRP_MJ_INTERNAL_DEVICE_CONTROL
[115612 ms] UsbSnoop - MyDispatchInternalIOCTL(f78d6e80) : fdo=826b8a00, Irp=826a7a20, IRQL=0
[115612 ms]  >>>  URB 92 going down  >>> 
-- URB_FUNCTION_BULK_OR_INTERRUPT_TRANSFER:
  PipeHandle           = 82a3d2b4 [endpoint 0x00000002]
  TransferFlags        = 00000000 (USBD_TRANSFER_DIRECTION_OUT, ~USBD_SHORT_TRANSFER_OK)
  TransferBufferLength = 00000014
  TransferBuffer       = f7bcfb48
  TransferBufferMDL    = 00000000
    00000000: 1b 28 00 0a 00 00 00 0e 05 20 20 00 00 00 00 00
    00000010: 00 00 69 19
  UrbLink              = 00000000
[115613 ms] UsbSnoop - MyInternalIOCTLCompletion(f78d6db0) : fido=00000000, Irp=826a7a20, Context=82a82620, IRQL=2
[115613 ms]  <<<  URB 92 coming back  <<< 
-- URB_FUNCTION_BULK_OR_INTERRUPT_TRANSFER:
  PipeHandle           = 82a3d2b4 [endpoint 0x00000002]
  TransferFlags        = 00000000 (USBD_TRANSFER_DIRECTION_OUT, ~USBD_SHORT_TRANSFER_OK)
  TransferBufferLength = 00000014
  TransferBuffer       = f7bcfb48
  TransferBufferMDL    = 82b37c48
  UrbLink              = 00000000
[115613 ms] UsbSnoop - DispatchAny(f78d5610) : IRP_MJ_INTERNAL_DEVICE_CONTROL
[115613 ms] UsbSnoop - MyDispatchInternalIOCTL(f78d6e80) : fdo=826b8a00, Irp=82a5b5f8, IRQL=0
[115613 ms]  >>>  URB 93 going down  >>> 
-- URB_FUNCTION_BULK_OR_INTERRUPT_TRANSFER:
  PipeHandle           = 82a3d294 [endpoint 0x00000082]
  TransferFlags        = 00000003 (USBD_TRANSFER_DIRECTION_IN, USBD_SHORT_TRANSFER_OK)
  TransferBufferLength = 00000118
  TransferBuffer       = f7c49df8
  TransferBufferMDL    = 00000000
  UrbLink              = 00000000
[115615 ms] UsbSnoop - MyInternalIOCTLCompletion(f78d6db0) : fido=00000000, Irp=82a5b5f8, Context=82a5c2b8, IRQL=2
[115615 ms]  <<<  URB 93 coming back  <<< 
-- URB_FUNCTION_BULK_OR_INTERRUPT_TRANSFER:
  PipeHandle           = 82a3d294 [endpoint 0x00000082]
  TransferFlags        = 00000003 (USBD_TRANSFER_DIRECTION_IN, USBD_SHORT_TRANSFER_OK)
  TransferBufferLength = 0000002b
  TransferBuffer       = f7c49df8
  TransferBufferMDL    = 82aa64b0
    00000000: 1b 28 00 21 00 00 00 0e 82 00 00 64 00 ef 00 ef
    00000010: 00 64 00 64 00 ff 08 42 00 00 00 08 00 64 00 cc
    00000020: 00 80 ec 60 00 59 08 b8 00 d7 b7
  UrbLink              = 00000000
[115615 ms] UsbSnoop - DispatchAny(f78d5610) : IRP_MJ_INTERNAL_DEVICE_CONTROL
[115615 ms] UsbSnoop - MyDispatchInternalIOCTL(f78d6e80) : fdo=826b8a00, Irp=82a5b5f8, IRQL=0
[115615 ms]  >>>  URB 94 going down  >>> 
-- URB_FUNCTION_BULK_OR_INTERRUPT_TRANSFER:
  PipeHandle           = 82a3d294 [endpoint 0x00000082]
  TransferFlags        = 00000003 (USBD_TRANSFER_DIRECTION_IN, USBD_SHORT_TRANSFER_OK)
  TransferBufferLength = 00000118
  TransferBuffer       = f7c3bdf8
  TransferBufferMDL    = 00000000
  UrbLink              = 00000000
